================================================================================
--------------------------------------------------------------------------------
|                         CROSSWALK REPRODUCTION SUITE                         |
--------------------------------------------------------------------------------
================================================================================
++++++++++++++++++++++++++++++++++++++++++++++++++++++++++++++++++++++++++++++++
             Experiment start time: 2026-01-16 12:15:45.233511
++++++++++++++++++++++++++++++++++++++++++++++++++++++++++++++++++++++++++++++++
Repeating experiment config: 
       'experiments/linkpred_rice_node2vec_skip.yml' 
5 times and averaging results
================================================================================
                        Performing experiment trial 1/5
================================================================================
loaded graph: data/dgl_graphs/rice/graph.bin
saved graph
Graph on device: cpu
graph shape, num_nodes=439, num_edges=19320
using prior edge weights without reweighting..
absolute difference between median of weights after reweighting: 0.0
generating node embeddings..
training on device: cpu
training node2vec model with : adam, lr=0.025, batch_size=32
saving embedding file to /local/hase/crosswalk-reproduction/results/experiment_57_linkpred_rice_node2vec_skip/embeddings/emb_0_node2vec_ed32_wl40_cs10_wpn80_nns5.pt
performing link prediction task..
Edge type 0 has accuracy: 57.04545454545455
Edge type 1 has accuracy: 53.003875968992254
Edge type 2 has accuracy: 55.208333333333336
Accuracy: 55.87474120082816
Disparity: 2.729889334326923
================================================================================
                        Performing experiment trial 2/5
================================================================================
loaded graph: data/dgl_graphs/rice/graph.bin
saved graph
Graph on device: cpu
graph shape, num_nodes=439, num_edges=19320
using prior edge weights without reweighting..
absolute difference between median of weights after reweighting: 0.0
generating node embeddings..
training on device: cpu
training node2vec model with : adam, lr=0.025, batch_size=32
saving embedding file to /local/hase/crosswalk-reproduction/results/experiment_57_linkpred_rice_node2vec_skip/embeddings/emb_1_node2vec_ed32_wl40_cs10_wpn80_nns5.pt
performing link prediction task..
Edge type 0 has accuracy: 56.00303951367781
Edge type 1 has accuracy: 51.5850144092219
Edge type 2 has accuracy: 53.403141361256544
Accuracy: 54.684265010351965
Disparity: 3.287111315586779
================================================================================
                        Performing experiment trial 3/5
================================================================================
loaded graph: data/dgl_graphs/rice/graph.bin
saved graph
Graph on device: cpu
graph shape, num_nodes=439, num_edges=19320
using prior edge weights without reweighting..
absolute difference between median of weights after reweighting: 0.0
generating node embeddings..
training on device: cpu
training node2vec model with : adam, lr=0.025, batch_size=32
saving embedding file to /local/hase/crosswalk-reproduction/results/experiment_57_linkpred_rice_node2vec_skip/embeddings/emb_2_node2vec_ed32_wl40_cs10_wpn80_nns5.pt
performing link prediction task..
Edge type 0 has accuracy: 58.92857142857143
Edge type 1 has accuracy: 52.77777777777778
Edge type 2 has accuracy: 48.40425531914894
Accuracy: 56.75465838509317
Disparity: 18.63568786686935
================================================================================
                        Performing experiment trial 4/5
================================================================================
loaded graph: data/dgl_graphs/rice/graph.bin
saved graph
Graph on device: cpu
graph shape, num_nodes=439, num_edges=19320
using prior edge weights without reweighting..
absolute difference between median of weights after reweighting: 0.0
generating node embeddings..
training on device: cpu
training node2vec model with : adam, lr=0.025, batch_size=32
saving embedding file to /local/hase/crosswalk-reproduction/results/experiment_57_linkpred_rice_node2vec_skip/embeddings/emb_3_node2vec_ed32_wl40_cs10_wpn80_nns5.pt
performing link prediction task..
Edge type 0 has accuracy: 55.74952561669829
Edge type 1 has accuracy: 54.58052073288332
Edge type 2 has accuracy: 54.6875
Accuracy: 55.38302277432712
Disparity: 0.2784350436110515
================================================================================
                        Performing experiment trial 5/5
================================================================================
loaded graph: data/dgl_graphs/rice/graph.bin
saved graph
Graph on device: cpu
graph shape, num_nodes=439, num_edges=19320
using prior edge weights without reweighting..
absolute difference between median of weights after reweighting: 0.0
generating node embeddings..
training on device: cpu
training node2vec model with : adam, lr=0.025, batch_size=32
saving embedding file to /local/hase/crosswalk-reproduction/results/experiment_57_linkpred_rice_node2vec_skip/embeddings/emb_4_node2vec_ed32_wl40_cs10_wpn80_nns5.pt
performing link prediction task..
Edge type 0 has accuracy: 57.97872340425532
Edge type 1 has accuracy: 53.26923076923077
Edge type 2 has accuracy: 55.729166666666664
Accuracy: 56.59937888198758
Disparity: 3.699012334941642
================================================================================
results for task link prediciton
--------------------------------------------------------------------------------
run 0:
    accuracy: 55.87474120082816
    disparity: 2.729889334326923
--------------------------------------------------------------------------------
run 1:
    accuracy: 54.684265010351965
    disparity: 3.287111315586779
--------------------------------------------------------------------------------
run 2:
    accuracy: 56.75465838509317
    disparity: 18.63568786686935
--------------------------------------------------------------------------------
run 3:
    accuracy: 55.38302277432712
    disparity: 0.2784350436110515
--------------------------------------------------------------------------------
run 4:
    accuracy: 56.59937888198758
    disparity: 3.699012334941642
================================================================================
final average of all runs:
    accuracy: 55.8592132505176
    disparity: 5.726027179067149

final std/var of all runs:
    accuracy: std=0.7690473333895794, var=0.591433800993623
    disparity: std=6.5630715507389485, var=43.07390818011895
--------------------------------------------------------------------------------
accuracy values raw:
[55.87474120082816, 54.684265010351965, 56.75465838509317, 55.38302277432712, 56.59937888198758]
disparity values raw:
[2.729889334326923, 3.287111315586779, 18.63568786686935, 0.2784350436110515, 3.699012334941642]
================================================================================
++++++++++++++++++++++++++++++++++++++++++++++++++++++++++++++++++++++++++++++++
             Experiment end time: 2026-01-16 12:18:39.301618
++++++++++++++++++++++++++++++++++++++++++++++++++++++++++++++++++++++++++++++++
