================================================================================
--------------------------------------------------------------------------------
|                         CROSSWALK REPRODUCTION SUITE                         |
--------------------------------------------------------------------------------
================================================================================
++++++++++++++++++++++++++++++++++++++++++++++++++++++++++++++++++++++++++++++++
             Experiment start time: 2026-01-16 12:27:40.744693
++++++++++++++++++++++++++++++++++++++++++++++++++++++++++++++++++++++++++++++++
Repeating experiment config: 
       'experiments/linkpred_rice_node2vec_skip.yml' 
5 times and averaging results
================================================================================
                        Performing experiment trial 1/5
================================================================================
loaded graph: data/dgl_graphs/rice/graph.bin
saved graph
Graph on device: cpu
graph shape, num_nodes=439, num_edges=19320
using prior edge weights without reweighting..
absolute difference between median of weights after reweighting: 0.0
generating node embeddings..
training on device: cpu
training node2vec model with : adam, lr=0.025, batch_size=32
saving embedding file to /local/hase/crosswalk-reproduction/results/experiment_61_linkpred_rice_node2vec_skip/embeddings/emb_0_node2vec_ed32_wl40_cs10_wpn80_nns5.pt
performing link prediction task..
Edge type 0 has accuracy: 57.67336112163698
Edge type 1 has accuracy: 52.71317829457365
Edge type 2 has accuracy: 55.44041450777202
Accuracy: 56.23706004140787
Disparity: 4.114142402316167
================================================================================
                        Performing experiment trial 2/5
================================================================================
loaded graph: data/dgl_graphs/rice/graph.bin
saved graph
Graph on device: cpu
graph shape, num_nodes=439, num_edges=19320
using prior edge weights without reweighting..
absolute difference between median of weights after reweighting: 0.0
generating node embeddings..
training on device: cpu
training node2vec model with : adam, lr=0.025, batch_size=32
saving embedding file to /local/hase/crosswalk-reproduction/results/experiment_61_linkpred_rice_node2vec_skip/embeddings/emb_1_node2vec_ed32_wl40_cs10_wpn80_nns5.pt
performing link prediction task..
Edge type 0 has accuracy: 55.753892897835165
Edge type 1 has accuracy: 51.53846153846153
Edge type 2 has accuracy: 51.30890052356021
Accuracy: 54.399585921325055
Disparity: 4.1756130013906265
================================================================================
                        Performing experiment trial 3/5
================================================================================
loaded graph: data/dgl_graphs/rice/graph.bin
saved graph
Graph on device: cpu
graph shape, num_nodes=439, num_edges=19320
using prior edge weights without reweighting..
absolute difference between median of weights after reweighting: 0.0
generating node embeddings..
training on device: cpu
training node2vec model with : adam, lr=0.025, batch_size=32
saving embedding file to /local/hase/crosswalk-reproduction/results/experiment_61_linkpred_rice_node2vec_skip/embeddings/emb_2_node2vec_ed32_wl40_cs10_wpn80_nns5.pt
performing link prediction task..
Edge type 0 has accuracy: 58.532877232991254
Edge type 1 has accuracy: 54.11877394636016
Edge type 2 has accuracy: 50.79365079365079
Accuracy: 56.96169772256729
Disparity: 10.048486409457531
================================================================================
                        Performing experiment trial 4/5
================================================================================
loaded graph: data/dgl_graphs/rice/graph.bin
saved graph
Graph on device: cpu
graph shape, num_nodes=439, num_edges=19320
using prior edge weights without reweighting..
absolute difference between median of weights after reweighting: 0.0
generating node embeddings..
training on device: cpu
training node2vec model with : adam, lr=0.025, batch_size=32
saving embedding file to /local/hase/crosswalk-reproduction/results/experiment_61_linkpred_rice_node2vec_skip/embeddings/emb_3_node2vec_ed32_wl40_cs10_wpn80_nns5.pt
performing link prediction task..
Edge type 0 has accuracy: 54.686907020872866
Edge type 1 has accuracy: 55.25554484088717
Edge type 2 has accuracy: 56.25
Accuracy: 54.917184265010356
Disparity: 0.417283299470365
================================================================================
                        Performing experiment trial 5/5
================================================================================
loaded graph: data/dgl_graphs/rice/graph.bin
saved graph
Graph on device: cpu
graph shape, num_nodes=439, num_edges=19320
using prior edge weights without reweighting..
absolute difference between median of weights after reweighting: 0.0
generating node embeddings..
training on device: cpu
training node2vec model with : adam, lr=0.025, batch_size=32
saving embedding file to /local/hase/crosswalk-reproduction/results/experiment_61_linkpred_rice_node2vec_skip/embeddings/emb_4_node2vec_ed32_wl40_cs10_wpn80_nns5.pt
performing link prediction task..
Edge type 0 has accuracy: 58.16869300911854
Edge type 1 has accuracy: 51.442307692307686
Edge type 2 has accuracy: 58.854166666666664
Accuracy: 56.39233954451346
Disparity: 11.183309669020757
================================================================================
results for task link prediciton
--------------------------------------------------------------------------------
run 0:
    accuracy: 56.23706004140787
    disparity: 4.114142402316167
--------------------------------------------------------------------------------
run 1:
    accuracy: 54.399585921325055
    disparity: 4.1756130013906265
--------------------------------------------------------------------------------
run 2:
    accuracy: 56.96169772256729
    disparity: 10.048486409457531
--------------------------------------------------------------------------------
run 3:
    accuracy: 54.917184265010356
    disparity: 0.417283299470365
--------------------------------------------------------------------------------
run 4:
    accuracy: 56.39233954451346
    disparity: 11.183309669020757
================================================================================
final average of all runs:
    accuracy: 55.7815734989648
    disparity: 5.987766956331089

final std/var of all runs:
    accuracy: std=0.9623154107050543, var=0.9260509496804374
    disparity: std=4.032561609040799, var=16.26155313070972
--------------------------------------------------------------------------------
accuracy values raw:
[56.23706004140787, 54.399585921325055, 56.96169772256729, 54.917184265010356, 56.39233954451346]
disparity values raw:
[4.114142402316167, 4.1756130013906265, 10.048486409457531, 0.417283299470365, 11.183309669020757]
================================================================================
++++++++++++++++++++++++++++++++++++++++++++++++++++++++++++++++++++++++++++++++
             Experiment end time: 2026-01-16 12:30:33.608522
++++++++++++++++++++++++++++++++++++++++++++++++++++++++++++++++++++++++++++++++
