================================================================================
--------------------------------------------------------------------------------
|                         CROSSWALK REPRODUCTION SUITE                         |
--------------------------------------------------------------------------------
================================================================================
++++++++++++++++++++++++++++++++++++++++++++++++++++++++++++++++++++++++++++++++
             Experiment start time: 2026-01-16 12:45:35.735711
++++++++++++++++++++++++++++++++++++++++++++++++++++++++++++++++++++++++++++++++
Repeating experiment config: 
       'experiments/linkpred_rice_node2vec_skip.yml' 
5 times and averaging results
================================================================================
                        Performing experiment trial 1/5
================================================================================
loaded graph: data/dgl_graphs/rice/graph.bin
saved graph
Graph on device: cpu
graph shape, num_nodes=439, num_edges=19320
using prior edge weights without reweighting..
absolute difference between median of weights after reweighting: 0.0
generating node embeddings..
training on device: cpu
training node2vec model with : adam, lr=0.025, batch_size=32
saving embedding file to /local/hase/crosswalk-reproduction/results/experiment_67_linkpred_rice_node2vec_skip/embeddings/emb_0_node2vec_ed32_wl40_cs10_wpn80_nns5.pt
performing link prediction task..
Edge type 0 has accuracy: 56.99128457749148
Edge type 1 has accuracy: 53.100775193798455
Edge type 2 has accuracy: 59.58549222797927
Accuracy: 56.081780538302276
Disparity: 7.101947956871971
================================================================================
                        Performing experiment trial 2/5
================================================================================
loaded graph: data/dgl_graphs/rice/graph.bin
saved graph
Graph on device: cpu
graph shape, num_nodes=439, num_edges=19320
using prior edge weights without reweighting..
absolute difference between median of weights after reweighting: 0.0
generating node embeddings..
training on device: cpu
training node2vec model with : adam, lr=0.025, batch_size=32
saving embedding file to /local/hase/crosswalk-reproduction/results/experiment_67_linkpred_rice_node2vec_skip/embeddings/emb_1_node2vec_ed32_wl40_cs10_wpn80_nns5.pt
performing link prediction task..
Edge type 0 has accuracy: 57.880744398025065
Edge type 1 has accuracy: 53.17307692307692
Edge type 2 has accuracy: 52.35602094240838
Accuracy: 56.34057971014492
Disparity: 5.928031421252452
================================================================================
                        Performing experiment trial 3/5
================================================================================
loaded graph: data/dgl_graphs/rice/graph.bin
saved graph
Graph on device: cpu
graph shape, num_nodes=439, num_edges=19320
using prior edge weights without reweighting..
absolute difference between median of weights after reweighting: 0.0
generating node embeddings..
training on device: cpu
training node2vec model with : adam, lr=0.025, batch_size=32
saving embedding file to /local/hase/crosswalk-reproduction/results/experiment_67_linkpred_rice_node2vec_skip/embeddings/emb_2_node2vec_ed32_wl40_cs10_wpn80_nns5.pt
performing link prediction task..
Edge type 0 has accuracy: 60.357278601292286
Edge type 1 has accuracy: 55.11961722488038
Edge type 2 has accuracy: 55.319148936170215
Accuracy: 58.69565217391305
Disparity: 5.872851124483373
================================================================================
                        Performing experiment trial 4/5
================================================================================
loaded graph: data/dgl_graphs/rice/graph.bin
saved graph
Graph on device: cpu
graph shape, num_nodes=439, num_edges=19320
using prior edge weights without reweighting..
absolute difference between median of weights after reweighting: 0.0
generating node embeddings..
training on device: cpu
training node2vec model with : adam, lr=0.025, batch_size=32
saving embedding file to /local/hase/crosswalk-reproduction/results/experiment_67_linkpred_rice_node2vec_skip/embeddings/emb_3_node2vec_ed32_wl40_cs10_wpn80_nns5.pt
performing link prediction task..
Edge type 0 has accuracy: 55.77069096431283
Edge type 1 has accuracy: 52.89017341040463
Edge type 2 has accuracy: 57.8125
Accuracy: 55.09834368530021
Disparity: 4.077296063469406
================================================================================
                        Performing experiment trial 5/5
================================================================================
loaded graph: data/dgl_graphs/rice/graph.bin
saved graph
Graph on device: cpu
graph shape, num_nodes=439, num_edges=19320
using prior edge weights without reweighting..
absolute difference between median of weights after reweighting: 0.0
generating node embeddings..
training on device: cpu
training node2vec model with : adam, lr=0.025, batch_size=32
saving embedding file to /local/hase/crosswalk-reproduction/results/experiment_67_linkpred_rice_node2vec_skip/embeddings/emb_4_node2vec_ed32_wl40_cs10_wpn80_nns5.pt
performing link prediction task..
Edge type 0 has accuracy: 60.121534371439424
Edge type 1 has accuracy: 51.588065447545716
Edge type 2 has accuracy: 55.729166666666664
Accuracy: 57.608695652173914
Disparity: 12.140189470666149
================================================================================
results for task link prediciton
--------------------------------------------------------------------------------
run 0:
    accuracy: 56.081780538302276
    disparity: 7.101947956871971
--------------------------------------------------------------------------------
run 1:
    accuracy: 56.34057971014492
    disparity: 5.928031421252452
--------------------------------------------------------------------------------
run 2:
    accuracy: 58.69565217391305
    disparity: 5.872851124483373
--------------------------------------------------------------------------------
run 3:
    accuracy: 55.09834368530021
    disparity: 4.077296063469406
--------------------------------------------------------------------------------
run 4:
    accuracy: 57.608695652173914
    disparity: 12.140189470666149
================================================================================
final average of all runs:
    accuracy: 56.765010351966886
    disparity: 7.024063207348671

final std/var of all runs:
    accuracy: std=1.2541056459651565, var=1.5727809712416825
    disparity: std=2.7346233931761006, var=7.4781651025059706
--------------------------------------------------------------------------------
accuracy values raw:
[56.081780538302276, 56.34057971014492, 58.69565217391305, 55.09834368530021, 57.608695652173914]
disparity values raw:
[7.101947956871971, 5.928031421252452, 5.872851124483373, 4.077296063469406, 12.140189470666149]
================================================================================
++++++++++++++++++++++++++++++++++++++++++++++++++++++++++++++++++++++++++++++++
             Experiment end time: 2026-01-16 12:48:32.043559
++++++++++++++++++++++++++++++++++++++++++++++++++++++++++++++++++++++++++++++++
