================================================================================
--------------------------------------------------------------------------------
|                         CROSSWALK REPRODUCTION SUITE                         |
--------------------------------------------------------------------------------
================================================================================
++++++++++++++++++++++++++++++++++++++++++++++++++++++++++++++++++++++++++++++++
             Experiment start time: 2026-01-12 11:58:45.848560
++++++++++++++++++++++++++++++++++++++++++++++++++++++++++++++++++++++++++++++++
Repeating experiment config: 
       'experiments/infmax_rice_deepwalk_skip.yml' 
5 times and averaging results
================================================================================
                        Performing experiment trial 1/5
================================================================================
loaded graph: data/dgl_graphs/pokec_gender/graph.bin
saved graph
Graph on device: cpu
graph shape, num_nodes=69949, num_edges=260044
using prior edge weights without reweighting..
absolute difference between median of weights after reweighting: 0.0
generating node embeddings..
training on device: cuda
training deepwalk model with : adam, lr=0.025, batch_size=32
saving embedding file to /local/hase/crosswalk-reproduction/results/experiment_0_infmax_pokec_gender_deepwalk_skip/embeddings/emb_0_deepwalk_ed32_wl40_cs10_wpn80_nns5.pt
performing influence maximization task..
Infected nodes fraction (%): 0.057184520150395296
Infected nodes fraction per group (%):
    Group 0:0.05000624805688858
    Group 1:0.06323611014522612
Disparity: 4.375731271910774e-05
================================================================================
                        Performing experiment trial 2/5
================================================================================
loaded graph: data/dgl_graphs/pokec_gender/graph.bin
saved graph
Graph on device: cpu
graph shape, num_nodes=69949, num_edges=260044
using prior edge weights without reweighting..
absolute difference between median of weights after reweighting: 0.0
generating node embeddings..
training on device: cuda
training deepwalk model with : adam, lr=0.025, batch_size=32
saving embedding file to /local/hase/crosswalk-reproduction/results/experiment_0_infmax_pokec_gender_deepwalk_skip/embeddings/emb_1_deepwalk_ed32_wl40_cs10_wpn80_nns5.pt
performing influence maximization task..
Infected nodes fraction (%): 0.057184520150395296
Infected nodes fraction per group (%):
    Group 0:0.05313163856044412
    Group 1:0.06060127052478492
Disparity: 1.3948850420675472e-05
================================================================================
                        Performing experiment trial 3/5
================================================================================
loaded graph: data/dgl_graphs/pokec_gender/graph.bin
saved graph
Graph on device: cpu
graph shape, num_nodes=69949, num_edges=260044
using prior edge weights without reweighting..
absolute difference between median of weights after reweighting: 0.0
generating node embeddings..
training on device: cuda
training deepwalk model with : adam, lr=0.025, batch_size=32
saving embedding file to /local/hase/crosswalk-reproduction/results/experiment_0_infmax_pokec_gender_deepwalk_skip/embeddings/emb_2_deepwalk_ed32_wl40_cs10_wpn80_nns5.pt
performing influence maximization task..
Infected nodes fraction (%): 0.057184520150395296
Infected nodes fraction per group (%):
    Group 0:0.034379298449493945
    Group 1:0.07641029660589993
Disparity: 0.00044165120150595086
================================================================================
                        Performing experiment trial 4/5
================================================================================
loaded graph: data/dgl_graphs/pokec_gender/graph.bin
saved graph
Graph on device: cpu
graph shape, num_nodes=69949, num_edges=260044
using prior edge weights without reweighting..
absolute difference between median of weights after reweighting: 0.0
generating node embeddings..
training on device: cuda
training deepwalk model with : adam, lr=0.025, batch_size=32
saving embedding file to /local/hase/crosswalk-reproduction/results/experiment_0_infmax_pokec_gender_deepwalk_skip/embeddings/emb_3_deepwalk_ed32_wl40_cs10_wpn80_nns5.pt
performing influence maximization task..
Infected nodes fraction (%): 0.057184520150395296
Infected nodes fraction per group (%):
    Group 0:0.056257034884765744
    Group 1:0.057966430904343724
Disparity: 7.305086879372605e-07
================================================================================
                        Performing experiment trial 5/5
================================================================================
loaded graph: data/dgl_graphs/pokec_gender/graph.bin
saved graph
Graph on device: cpu
graph shape, num_nodes=69949, num_edges=260044
using prior edge weights without reweighting..
absolute difference between median of weights after reweighting: 0.0
generating node embeddings..
training on device: cuda
training deepwalk model with : adam, lr=0.025, batch_size=32
saving embedding file to /local/hase/crosswalk-reproduction/results/experiment_0_infmax_pokec_gender_deepwalk_skip/embeddings/emb_4_deepwalk_ed32_wl40_cs10_wpn80_nns5.pt
performing influence maximization task..
Infected nodes fraction (%): 0.057184520150395296
Infected nodes fraction per group (%):
    Group 0:0.05313163856044412
    Group 1:0.06060127052478492
Disparity: 1.3948850420675472e-05
================================================================================
results for task influence maximization
--------------------------------------------------------------------------------
run 0:
    infected_nodes_fraction: 0.057184520150395296
    disparity: 4.375731271910774e-05
--------------------------------------------------------------------------------
run 1:
    infected_nodes_fraction: 0.057184520150395296
    disparity: 1.3948850420675472e-05
--------------------------------------------------------------------------------
run 2:
    infected_nodes_fraction: 0.057184520150395296
    disparity: 0.00044165120150595086
--------------------------------------------------------------------------------
run 3:
    infected_nodes_fraction: 0.057184520150395296
    disparity: 7.305086879372605e-07
--------------------------------------------------------------------------------
run 4:
    infected_nodes_fraction: 0.057184520150395296
    disparity: 1.3948850420675472e-05
================================================================================
final mean of all runs:
    infected_nodes_fraction: 0.0571845201503953
    disparities: 0.00010280734475086935

final std/var of all runs:
    infected_nodes_fraction: std=6.938893903907228e-18, var=4.81482486096809e-35
    disparities: std=0.00017000788807198752, var=2.8902682006697435e-08
--------------------------------------------------------------------------------
infected_nodes_fraction values raw:
[0.057184520150395296, 0.057184520150395296, 0.057184520150395296, 0.057184520150395296, 0.057184520150395296]
disparity values raw:
[4.375731271910774e-05, 1.3948850420675472e-05, 0.00044165120150595086, 7.305086879372605e-07, 1.3948850420675472e-05]
================================================================================
++++++++++++++++++++++++++++++++++++++++++++++++++++++++++++++++++++++++++++++++
             Experiment end time: 2026-01-12 12:28:55.800390
++++++++++++++++++++++++++++++++++++++++++++++++++++++++++++++++++++++++++++++++
