================================================================================
--------------------------------------------------------------------------------
|                         CROSSWALK REPRODUCTION SUITE                         |
--------------------------------------------------------------------------------
================================================================================
++++++++++++++++++++++++++++++++++++++++++++++++++++++++++++++++++++++++++++++++
             Experiment start time: 2026-01-07 16:23:19.930725
++++++++++++++++++++++++++++++++++++++++++++++++++++++++++++++++++++++++++++++++
Repeating experiment config: 
       'experiments/linkpred_rice_deepwalk_crosswalk.yml' 
5 times and averaging results
================================================================================
                        Performing experiment trial 1/5
================================================================================
reading: data/immutable/rice/rice_subset.attr
number of attributed ids: 445, ids with edges: 439, number of links with attributes: 19320
Found unconnected nodes in graph! Removing 6 unconnected nodes
no edge weights given, initializing all as uniform normalized.
detected rice_raw dataset!
before rice parsing! num nodes:439, num edges:19320
after rice parsing! num nodes:439, num edges:19320
loaded graph: rice
saved graph
Graph on device: cpu
graph shape, num_nodes=439, num_edges=19320
performing edge reweighting with crosswalk
reweighted edges
absolute difference between median of weights after reweighting: 0.006694887764751911
generating node embeddings..
training on device: cuda
training deepwalk model with : adam, lr=0.025, batch_size=32
saving embedding file to /local/hase/crosswalk-reproduction/results/experiment_1_linkpred_rice_deepwalk_crosswalk/embeddings/emb_0_deepwalk_ed32_wl40_cs10_wpn80_nns5.pt
performing link prediction task..
Edge type 0 has accuracy: 57.1917808219178
Edge type 1 has accuracy: 53.441682600382414
Edge type 2 has accuracy: 53.68421052631579
Accuracy: 56.00414078674948
Disparity: 2.9361228716233376
================================================================================
                        Performing experiment trial 2/5
================================================================================
reading: data/immutable/rice/rice_subset.attr
number of attributed ids: 445, ids with edges: 439, number of links with attributes: 19320
Found unconnected nodes in graph! Removing 6 unconnected nodes
no edge weights given, initializing all as uniform normalized.
detected rice_raw dataset!
before rice parsing! num nodes:439, num edges:19320
after rice parsing! num nodes:439, num edges:19320
loaded graph: rice
saved graph
Graph on device: cpu
graph shape, num_nodes=439, num_edges=19320
performing edge reweighting with crosswalk
reweighted edges
absolute difference between median of weights after reweighting: 0.006657158024609089
generating node embeddings..
training on device: cuda
training deepwalk model with : adam, lr=0.025, batch_size=32
saving embedding file to /local/hase/crosswalk-reproduction/results/experiment_1_linkpred_rice_deepwalk_crosswalk/embeddings/emb_1_deepwalk_ed32_wl40_cs10_wpn80_nns5.pt
performing link prediction task..
Edge type 0 has accuracy: 55.37878787878788
Edge type 1 has accuracy: 56.908212560386474
Edge type 2 has accuracy: 52.910052910052904
Accuracy: 55.66770186335403
Disparity: 2.713230310232588
================================================================================
                        Performing experiment trial 3/5
================================================================================
reading: data/immutable/rice/rice_subset.attr
number of attributed ids: 445, ids with edges: 439, number of links with attributes: 19320
Found unconnected nodes in graph! Removing 6 unconnected nodes
no edge weights given, initializing all as uniform normalized.
detected rice_raw dataset!
before rice parsing! num nodes:439, num edges:19320
after rice parsing! num nodes:439, num edges:19320
loaded graph: rice
saved graph
Graph on device: cpu
graph shape, num_nodes=439, num_edges=19320
performing edge reweighting with crosswalk
reweighted edges
absolute difference between median of weights after reweighting: 0.006663640029728413
generating node embeddings..
training on device: cuda
training deepwalk model with : adam, lr=0.025, batch_size=32
saving embedding file to /local/hase/crosswalk-reproduction/results/experiment_1_linkpred_rice_deepwalk_crosswalk/embeddings/emb_2_deepwalk_ed32_wl40_cs10_wpn80_nns5.pt
performing link prediction task..
Edge type 0 has accuracy: 58.56164383561644
Edge type 1 has accuracy: 55.896452540747845
Edge type 2 has accuracy: 52.84974093264248
Accuracy: 57.55693581780539
Disparity: 5.445725670467728
================================================================================
                        Performing experiment trial 4/5
================================================================================
reading: data/immutable/rice/rice_subset.attr
number of attributed ids: 445, ids with edges: 439, number of links with attributes: 19320
Found unconnected nodes in graph! Removing 6 unconnected nodes
no edge weights given, initializing all as uniform normalized.
detected rice_raw dataset!
before rice parsing! num nodes:439, num edges:19320
after rice parsing! num nodes:439, num edges:19320
loaded graph: rice
saved graph
Graph on device: cpu
graph shape, num_nodes=439, num_edges=19320
performing edge reweighting with crosswalk
reweighted edges
absolute difference between median of weights after reweighting: 0.006627457216382027
generating node embeddings..
training on device: cuda
training deepwalk model with : adam, lr=0.025, batch_size=32
saving embedding file to /local/hase/crosswalk-reproduction/results/experiment_1_linkpred_rice_deepwalk_crosswalk/embeddings/emb_3_deepwalk_ed32_wl40_cs10_wpn80_nns5.pt
performing link prediction task..
Edge type 0 has accuracy: 55.77142857142857
Edge type 1 has accuracy: 56.07655502392345
Edge type 2 has accuracy: 53.608247422680414
Accuracy: 55.74534161490683
Disparity: 1.207221916518405
================================================================================
                        Performing experiment trial 5/5
================================================================================
reading: data/immutable/rice/rice_subset.attr
number of attributed ids: 445, ids with edges: 439, number of links with attributes: 19320
Found unconnected nodes in graph! Removing 6 unconnected nodes
no edge weights given, initializing all as uniform normalized.
detected rice_raw dataset!
before rice parsing! num nodes:439, num edges:19320
after rice parsing! num nodes:439, num edges:19320
loaded graph: rice
saved graph
Graph on device: cpu
graph shape, num_nodes=439, num_edges=19320
performing edge reweighting with crosswalk
reweighted edges
absolute difference between median of weights after reweighting: 0.006675541400909424
generating node embeddings..
training on device: cuda
training deepwalk model with : adam, lr=0.025, batch_size=32
saving embedding file to /local/hase/crosswalk-reproduction/results/experiment_1_linkpred_rice_deepwalk_crosswalk/embeddings/emb_4_deepwalk_ed32_wl40_cs10_wpn80_nns5.pt
performing link prediction task..
Edge type 0 has accuracy: 57.19711355867831
Edge type 1 has accuracy: 58.108108108108105
Edge type 2 has accuracy: 55.38461538461539
Accuracy: 57.34989648033127
Disparity: 1.2813859238877792
================================================================================
results for task link prediciton
--------------------------------------------------------------------------------
run 0:
    accuracy: 56.00414078674948
    disparity: 2.9361228716233376
--------------------------------------------------------------------------------
run 1:
    accuracy: 55.66770186335403
    disparity: 2.713230310232588
--------------------------------------------------------------------------------
run 2:
    accuracy: 57.55693581780539
    disparity: 5.445725670467728
--------------------------------------------------------------------------------
run 3:
    accuracy: 55.74534161490683
    disparity: 1.207221916518405
--------------------------------------------------------------------------------
run 4:
    accuracy: 57.34989648033127
    disparity: 1.2813859238877792
================================================================================
final average of all runs:
    accuracy: 56.4648033126294
    disparity: 2.7167373385459674

final std/var of all runs:
    accuracy: std=0.8174777234948132, var=0.6682698284102623
    disparity: std=1.5384661270263094, var=2.366878024007332
--------------------------------------------------------------------------------
accuracy values raw:
[56.00414078674948, 55.66770186335403, 57.55693581780539, 55.74534161490683, 57.34989648033127]
disparity values raw:
[2.9361228716233376, 2.713230310232588, 5.445725670467728, 1.207221916518405, 1.2813859238877792]
================================================================================
++++++++++++++++++++++++++++++++++++++++++++++++++++++++++++++++++++++++++++++++
             Experiment end time: 2026-01-07 16:25:23.057985
++++++++++++++++++++++++++++++++++++++++++++++++++++++++++++++++++++++++++++++++
