================================================================================
--------------------------------------------------------------------------------
|                         CROSSWALK REPRODUCTION SUITE                         |
--------------------------------------------------------------------------------
================================================================================
++++++++++++++++++++++++++++++++++++++++++++++++++++++++++++++++++++++++++++++++
             Experiment start time: 2026-01-07 16:25:26.320869
++++++++++++++++++++++++++++++++++++++++++++++++++++++++++++++++++++++++++++++++
Repeating experiment config: 
       'experiments/infmax_rice_deepwalk_crosswalk.yml' 
5 times and averaging results
================================================================================
                        Performing experiment trial 1/5
================================================================================
reading: data/immutable/rice/rice_subset.attr
number of attributed ids: 445, ids with edges: 439, number of links with attributes: 19320
Found unconnected nodes in graph! Removing 6 unconnected nodes
no edge weights given, initializing all as uniform normalized.
detected rice_raw dataset!
before rice parsing! num nodes:439, num edges:19320
after rice parsing! num nodes:439, num edges:19320
loaded graph: rice
saved graph
Graph on device: cpu
graph shape, num_nodes=439, num_edges=19320
performing edge reweighting with crosswalk
reweighted edges
absolute difference between median of weights after reweighting: 0.007503884844481945
generating node embeddings..
training on device: cuda
training deepwalk model with : adam, lr=0.025, batch_size=32
saving embedding file to /local/hase/crosswalk-reproduction/results/experiment_2_infmax_rice_deepwalk_crosswalk/embeddings/emb_0_deepwalk_ed32_wl40_cs10_wpn80_nns5.pt
performing influence maximization task..
Infected nodes fraction (%): 13.66742596810934
Infected nodes fraction per group (%):
    Group 0.0:15.204678475856781
    Group 1.0:8.24742242693901
Disparity: 12.100852932550726
================================================================================
                        Performing experiment trial 2/5
================================================================================
reading: data/immutable/rice/rice_subset.attr
number of attributed ids: 445, ids with edges: 439, number of links with attributes: 19320
Found unconnected nodes in graph! Removing 6 unconnected nodes
no edge weights given, initializing all as uniform normalized.
detected rice_raw dataset!
before rice parsing! num nodes:439, num edges:19320
after rice parsing! num nodes:439, num edges:19320
loaded graph: rice
saved graph
Graph on device: cpu
graph shape, num_nodes=439, num_edges=19320
performing edge reweighting with crosswalk
reweighted edges
absolute difference between median of weights after reweighting: 0.00722983293235302
generating node embeddings..
training on device: cuda
training deepwalk model with : adam, lr=0.025, batch_size=32
saving embedding file to /local/hase/crosswalk-reproduction/results/experiment_2_infmax_rice_deepwalk_crosswalk/embeddings/emb_1_deepwalk_ed32_wl40_cs10_wpn80_nns5.pt
performing influence maximization task..
Infected nodes fraction (%): 15.945330296127564
Infected nodes fraction per group (%):
    Group 0.0:17.836257815361023
    Group 1.0:9.278350323438644
Disparity: 18.309445160075295
================================================================================
                        Performing experiment trial 3/5
================================================================================
reading: data/immutable/rice/rice_subset.attr
number of attributed ids: 445, ids with edges: 439, number of links with attributes: 19320
Found unconnected nodes in graph! Removing 6 unconnected nodes
no edge weights given, initializing all as uniform normalized.
detected rice_raw dataset!
before rice parsing! num nodes:439, num edges:19320
after rice parsing! num nodes:439, num edges:19320
loaded graph: rice
saved graph
Graph on device: cpu
graph shape, num_nodes=439, num_edges=19320
performing edge reweighting with crosswalk
reweighted edges
absolute difference between median of weights after reweighting: 0.007381916046142578
generating node embeddings..
training on device: cuda
training deepwalk model with : adam, lr=0.025, batch_size=32
saving embedding file to /local/hase/crosswalk-reproduction/results/experiment_2_infmax_rice_deepwalk_crosswalk/embeddings/emb_2_deepwalk_ed32_wl40_cs10_wpn80_nns5.pt
performing influence maximization task..
Infected nodes fraction (%): 15.489749430523919
Infected nodes fraction per group (%):
    Group 0.0:18.12865436077118
    Group 1.0:6.185567006468773
Disparity: 35.659333888124515
================================================================================
                        Performing experiment trial 4/5
================================================================================
reading: data/immutable/rice/rice_subset.attr
number of attributed ids: 445, ids with edges: 439, number of links with attributes: 19320
Found unconnected nodes in graph! Removing 6 unconnected nodes
no edge weights given, initializing all as uniform normalized.
detected rice_raw dataset!
before rice parsing! num nodes:439, num edges:19320
after rice parsing! num nodes:439, num edges:19320
loaded graph: rice
saved graph
Graph on device: cpu
graph shape, num_nodes=439, num_edges=19320
performing edge reweighting with crosswalk
reweighted edges
absolute difference between median of weights after reweighting: 0.007308561354875565
generating node embeddings..
training on device: cuda
training deepwalk model with : adam, lr=0.025, batch_size=32
saving embedding file to /local/hase/crosswalk-reproduction/results/experiment_2_infmax_rice_deepwalk_crosswalk/embeddings/emb_3_deepwalk_ed32_wl40_cs10_wpn80_nns5.pt
performing influence maximization task..
Infected nodes fraction (%): 15.945330296127564
Infected nodes fraction per group (%):
    Group 0.0:19.005848467350006
    Group 1.0:5.154639109969139
Disparity: 47.964000165498824
================================================================================
                        Performing experiment trial 5/5
================================================================================
reading: data/immutable/rice/rice_subset.attr
number of attributed ids: 445, ids with edges: 439, number of links with attributes: 19320
Found unconnected nodes in graph! Removing 6 unconnected nodes
no edge weights given, initializing all as uniform normalized.
detected rice_raw dataset!
before rice parsing! num nodes:439, num edges:19320
after rice parsing! num nodes:439, num edges:19320
loaded graph: rice
saved graph
Graph on device: cpu
graph shape, num_nodes=439, num_edges=19320
performing edge reweighting with crosswalk
reweighted edges
absolute difference between median of weights after reweighting: 0.007403029128909111
generating node embeddings..
training on device: cuda
training deepwalk model with : adam, lr=0.025, batch_size=32
saving embedding file to /local/hase/crosswalk-reproduction/results/experiment_2_infmax_rice_deepwalk_crosswalk/embeddings/emb_4_deepwalk_ed32_wl40_cs10_wpn80_nns5.pt
performing influence maximization task..
Infected nodes fraction (%): 18.906605922551254
Infected nodes fraction per group (%):
    Group 0.0:20.76023370027542
    Group 1.0:12.371134012937546
Disparity: 17.59424839102311
================================================================================
results for task influence maximization
--------------------------------------------------------------------------------
run 0:
    infected_nodes_fraction: 13.66742596810934
    disparity: 12.100852932550726
--------------------------------------------------------------------------------
run 1:
    infected_nodes_fraction: 15.945330296127564
    disparity: 18.309445160075295
--------------------------------------------------------------------------------
run 2:
    infected_nodes_fraction: 15.489749430523919
    disparity: 35.659333888124515
--------------------------------------------------------------------------------
run 3:
    infected_nodes_fraction: 15.945330296127564
    disparity: 47.964000165498824
--------------------------------------------------------------------------------
run 4:
    infected_nodes_fraction: 18.906605922551254
    disparity: 17.59424839102311
================================================================================
final mean of all runs:
    infected_nodes_fraction: 15.990888382687928
    disparities: 26.32557610745449

final std/var of all runs:
    infected_nodes_fraction: std=1.6825681378240902, var=2.8310355384208266
    disparities: std=13.402817752128598, var=179.6355236967735
--------------------------------------------------------------------------------
infected_nodes_fraction values raw:
[13.66742596810934, 15.945330296127564, 15.489749430523919, 15.945330296127564, 18.906605922551254]
disparity values raw:
[12.100852932550726, 18.309445160075295, 35.659333888124515, 47.964000165498824, 17.59424839102311]
================================================================================
++++++++++++++++++++++++++++++++++++++++++++++++++++++++++++++++++++++++++++++++
             Experiment end time: 2026-01-07 16:27:20.567938
++++++++++++++++++++++++++++++++++++++++++++++++++++++++++++++++++++++++++++++++
