================================================================================
--------------------------------------------------------------------------------
|                         CROSSWALK REPRODUCTION SUITE                         |
--------------------------------------------------------------------------------
================================================================================
++++++++++++++++++++++++++++++++++++++++++++++++++++++++++++++++++++++++++++++++
             Experiment start time: 2026-01-07 17:54:45.437906
++++++++++++++++++++++++++++++++++++++++++++++++++++++++++++++++++++++++++++++++
Repeating experiment config: 
       'experiments/linkpred_deezer_deepwalk_fairwalk.yml' 
5 times and averaging results
================================================================================
                        Performing experiment trial 1/5
================================================================================
reading: data/immutable/deezer/deezer_europe.attr
number of attributed ids: 28281, ids with edges: 28281, number of links with attributes: 185504
no edge weights given, initializing all as uniform normalized.
loaded graph: deezer
saved graph
Graph on device: cpu
graph shape, num_nodes=28281, num_edges=185504
performing edge reweighting with fairwalk
absolute difference between median of weights after reweighting: 0.007575757801532745
generating node embeddings..
training on device: cuda
training deepwalk model with : adam, lr=0.025, batch_size=32
saving embedding file to /local/hase/crosswalk-reproduction/results/experiment_9_linkpred_deezer_deepwalk_fairwalk/embeddings/emb_0_deepwalk_ed32_wl40_cs10_wpn80_nns5.pt
performing link prediction task..
Edge type 0 has accuracy: 82.77996152881157
Edge type 1 has accuracy: 84.40106773440107
Edge type 2 has accuracy: 87.71464470194053
Accuracy: 84.51835480567085
Disparity: 4.217652852085655
================================================================================
                        Performing experiment trial 2/5
================================================================================
reading: data/immutable/deezer/deezer_europe.attr
number of attributed ids: 28281, ids with edges: 28281, number of links with attributes: 185504
no edge weights given, initializing all as uniform normalized.
loaded graph: deezer
saved graph
Graph on device: cpu
graph shape, num_nodes=28281, num_edges=185504
performing edge reweighting with fairwalk
absolute difference between median of weights after reweighting: 0.007575757801532745
generating node embeddings..
training on device: cuda
training deepwalk model with : adam, lr=0.025, batch_size=32
saving embedding file to /local/hase/crosswalk-reproduction/results/experiment_9_linkpred_deezer_deepwalk_fairwalk/embeddings/emb_1_deepwalk_ed32_wl40_cs10_wpn80_nns5.pt
performing link prediction task..
Edge type 0 has accuracy: 82.65987644014025
Edge type 1 has accuracy: 84.61066830165542
Edge type 2 has accuracy: 87.3033551440902
Accuracy: 84.50218317071855
Disparity: 3.6242273102679943
================================================================================
                        Performing experiment trial 3/5
================================================================================
reading: data/immutable/deezer/deezer_europe.attr
number of attributed ids: 28281, ids with edges: 28281, number of links with attributes: 185504
no edge weights given, initializing all as uniform normalized.
loaded graph: deezer
saved graph
Graph on device: cpu
graph shape, num_nodes=28281, num_edges=185504
performing edge reweighting with fairwalk
absolute difference between median of weights after reweighting: 0.007575757801532745
generating node embeddings..
training on device: cuda
training deepwalk model with : adam, lr=0.025, batch_size=32
saving embedding file to /local/hase/crosswalk-reproduction/results/experiment_9_linkpred_deezer_deepwalk_fairwalk/embeddings/emb_2_deepwalk_ed32_wl40_cs10_wpn80_nns5.pt
performing link prediction task..
Edge type 0 has accuracy: 82.57994307718064
Edge type 1 has accuracy: 84.35517970401692
Edge type 2 has accuracy: 86.66109718741298
Accuracy: 84.22996064902162
Disparity: 2.791615488106546
================================================================================
                        Performing experiment trial 4/5
================================================================================
reading: data/immutable/deezer/deezer_europe.attr
number of attributed ids: 28281, ids with edges: 28281, number of links with attributes: 185504
no edge weights given, initializing all as uniform normalized.
loaded graph: deezer
saved graph
Graph on device: cpu
graph shape, num_nodes=28281, num_edges=185504
performing edge reweighting with fairwalk
absolute difference between median of weights after reweighting: 0.007575757801532745
generating node embeddings..
training on device: cuda
training deepwalk model with : adam, lr=0.025, batch_size=32
saving embedding file to /local/hase/crosswalk-reproduction/results/experiment_9_linkpred_deezer_deepwalk_fairwalk/embeddings/emb_3_deepwalk_ed32_wl40_cs10_wpn80_nns5.pt
performing link prediction task..
Edge type 0 has accuracy: 82.6628753031697
Edge type 1 has accuracy: 84.22546182951257
Edge type 2 has accuracy: 87.6481249128677
Accuracy: 84.38359118106841
Disparity: 4.334334767273824
================================================================================
                        Performing experiment trial 5/5
================================================================================
reading: data/immutable/deezer/deezer_europe.attr
number of attributed ids: 28281, ids with edges: 28281, number of links with attributes: 185504
no edge weights given, initializing all as uniform normalized.
loaded graph: deezer
saved graph
Graph on device: cpu
graph shape, num_nodes=28281, num_edges=185504
performing edge reweighting with fairwalk
absolute difference between median of weights after reweighting: 0.007575757801532745
generating node embeddings..
training on device: cuda
training deepwalk model with : adam, lr=0.025, batch_size=32
saving embedding file to /local/hase/crosswalk-reproduction/results/experiment_9_linkpred_deezer_deepwalk_fairwalk/embeddings/emb_4_deepwalk_ed32_wl40_cs10_wpn80_nns5.pt
performing link prediction task..
Edge type 0 has accuracy: 83.11263828360711
Edge type 1 has accuracy: 84.6539060761184
Edge type 2 has accuracy: 87.27424284523478
Accuracy: 84.66659479273353
Disparity: 2.95118041324179
================================================================================
results for task link prediciton
--------------------------------------------------------------------------------
run 0:
    accuracy: 84.51835480567085
    disparity: 4.217652852085655
--------------------------------------------------------------------------------
run 1:
    accuracy: 84.50218317071855
    disparity: 3.6242273102679943
--------------------------------------------------------------------------------
run 2:
    accuracy: 84.22996064902162
    disparity: 2.791615488106546
--------------------------------------------------------------------------------
run 3:
    accuracy: 84.38359118106841
    disparity: 4.334334767273824
--------------------------------------------------------------------------------
run 4:
    accuracy: 84.66659479273353
    disparity: 2.95118041324179
================================================================================
final average of all runs:
    accuracy: 84.4601369198426
    disparity: 3.5838021661951616

final std/var of all runs:
    accuracy: std=0.146029057721553, var=0.02132448569904466
    disparity: std=0.6315805704436978, var=0.3988940169619867
--------------------------------------------------------------------------------
accuracy values raw:
[84.51835480567085, 84.50218317071855, 84.22996064902162, 84.38359118106841, 84.66659479273353]
disparity values raw:
[4.217652852085655, 3.6242273102679943, 2.791615488106546, 4.334334767273824, 2.95118041324179]
================================================================================
++++++++++++++++++++++++++++++++++++++++++++++++++++++++++++++++++++++++++++++++
             Experiment end time: 2026-01-07 18:24:19.864804
++++++++++++++++++++++++++++++++++++++++++++++++++++++++++++++++++++++++++++++++
