================================================================================
--------------------------------------------------------------------------------
|                         CROSSWALK REPRODUCTION SUITE                         |
--------------------------------------------------------------------------------
================================================================================
++++++++++++++++++++++++++++++++++++++++++++++++++++++++++++++++++++++++++++++++
             Experiment start time: 2026-01-08 17:07:25.163698
++++++++++++++++++++++++++++++++++++++++++++++++++++++++++++++++++++++++++++++++
Repeating experiment config: 
       'experiments/linkpred_pokec_region_deepwalk_fairwalk.yml' 
5 times and averaging results
================================================================================
                        Performing experiment trial 1/5
================================================================================
loaded graph: data/dgl_graphs/pokec_region/graph.bin
saved graph
Graph on device: cpu
graph shape, num_nodes=67796, num_edges=1235916
performing edge reweighting with fairwalk
absolute difference between median of weights after reweighting: 0.005769230425357819
generating node embeddings..
training on device: cuda
training deepwalk model with : adam, lr=0.025, batch_size=32
saving embedding file to /local/hase/crosswalk-reproduction/results/experiment_29_linkpred_pokec_region_deepwalk_fairwalk/embeddings/emb_0_deepwalk_ed32_wl40_cs10_wpn80_nns5.pt
performing link prediction task..
Edge type 0 has accuracy: 73.11049090938423
Edge type 1 has accuracy: 69.74602869587497
Edge type 2 has accuracy: 74.93992956123893
Accuracy: 72.71020778043886
Disparity: 4.627006440695557
================================================================================
                        Performing experiment trial 2/5
================================================================================
loaded graph: data/dgl_graphs/pokec_region/graph.bin
saved graph
Graph on device: cpu
graph shape, num_nodes=67796, num_edges=1235916
performing edge reweighting with fairwalk
absolute difference between median of weights after reweighting: 0.005769230425357819
generating node embeddings..
training on device: cuda
training deepwalk model with : adam, lr=0.025, batch_size=32
saving embedding file to /local/hase/crosswalk-reproduction/results/experiment_29_linkpred_pokec_region_deepwalk_fairwalk/embeddings/emb_1_deepwalk_ed32_wl40_cs10_wpn80_nns5.pt
performing link prediction task..
Edge type 0 has accuracy: 71.30309830957263
Edge type 1 has accuracy: 72.35038502092851
Edge type 2 has accuracy: 73.95908821397984
Accuracy: 72.22069389604505
Disparity: 1.1932241990476835
================================================================================
                        Performing experiment trial 3/5
================================================================================
loaded graph: data/dgl_graphs/pokec_region/graph.bin
saved graph
Graph on device: cpu
graph shape, num_nodes=67796, num_edges=1235916
performing edge reweighting with fairwalk
absolute difference between median of weights after reweighting: 0.005769230425357819
generating node embeddings..
training on device: cuda
training deepwalk model with : adam, lr=0.025, batch_size=32
saving embedding file to /local/hase/crosswalk-reproduction/results/experiment_29_linkpred_pokec_region_deepwalk_fairwalk/embeddings/emb_2_deepwalk_ed32_wl40_cs10_wpn80_nns5.pt
performing link prediction task..
Edge type 0 has accuracy: 73.11238193565039
Edge type 1 has accuracy: 71.4198786209547
Edge type 2 has accuracy: 75.20738692474818
Accuracy: 73.19972166483268
Disparity: 2.399870280656113
================================================================================
                        Performing experiment trial 4/5
================================================================================
loaded graph: data/dgl_graphs/pokec_region/graph.bin
saved graph
Graph on device: cpu
graph shape, num_nodes=67796, num_edges=1235916
performing edge reweighting with fairwalk
absolute difference between median of weights after reweighting: 0.005769230425357819
generating node embeddings..
training on device: cuda
training deepwalk model with : adam, lr=0.025, batch_size=32
saving embedding file to /local/hase/crosswalk-reproduction/results/experiment_29_linkpred_pokec_region_deepwalk_fairwalk/embeddings/emb_3_deepwalk_ed32_wl40_cs10_wpn80_nns5.pt
performing link prediction task..
Edge type 0 has accuracy: 73.38969923841488
Edge type 1 has accuracy: 68.36422961884807
Edge type 2 has accuracy: 74.98970532522937
Accuracy: 72.51157032817657
Disparity: 7.96803252343123
================================================================================
                        Performing experiment trial 5/5
================================================================================
loaded graph: data/dgl_graphs/pokec_region/graph.bin
saved graph
Graph on device: cpu
graph shape, num_nodes=67796, num_edges=1235916
performing edge reweighting with fairwalk
absolute difference between median of weights after reweighting: 0.005769230425357819
generating node embeddings..
training on device: cuda
training deepwalk model with : adam, lr=0.025, batch_size=32
saving embedding file to /local/hase/crosswalk-reproduction/results/experiment_29_linkpred_pokec_region_deepwalk_fairwalk/embeddings/emb_4_deepwalk_ed32_wl40_cs10_wpn80_nns5.pt
performing link prediction task..
Edge type 0 has accuracy: 71.64694399406302
Edge type 1 has accuracy: 68.84194703850582
Edge type 2 has accuracy: 72.94780731389773
Accuracy: 71.25663473363973
Disparity: 2.935371322068646
================================================================================
results for task link prediciton
--------------------------------------------------------------------------------
run 0:
    accuracy: 72.71020778043886
    disparity: 4.627006440695557
--------------------------------------------------------------------------------
run 1:
    accuracy: 72.22069389604505
    disparity: 1.1932241990476835
--------------------------------------------------------------------------------
run 2:
    accuracy: 73.19972166483268
    disparity: 2.399870280656113
--------------------------------------------------------------------------------
run 3:
    accuracy: 72.51157032817657
    disparity: 7.96803252343123
--------------------------------------------------------------------------------
run 4:
    accuracy: 71.25663473363973
    disparity: 2.935371322068646
================================================================================
final average of all runs:
    accuracy: 72.37976568062658
    disparity: 3.824700953179846

final std/var of all runs:
    accuracy: std=0.6458512551987583, var=0.41712384384181167
    disparity: std=2.3476205034891984, var=5.511322028402876
--------------------------------------------------------------------------------
accuracy values raw:
[72.71020778043886, 72.22069389604505, 73.19972166483268, 72.51157032817657, 71.25663473363973]
disparity values raw:
[4.627006440695557, 1.1932241990476835, 2.399870280656113, 7.96803252343123, 2.935371322068646]
================================================================================
++++++++++++++++++++++++++++++++++++++++++++++++++++++++++++++++++++++++++++++++
             Experiment end time: 2026-01-08 18:04:33.073535
++++++++++++++++++++++++++++++++++++++++++++++++++++++++++++++++++++++++++++++++
