================================================================================
--------------------------------------------------------------------------------
|                         CROSSWALK REPRODUCTION SUITE                         |
--------------------------------------------------------------------------------
================================================================================
++++++++++++++++++++++++++++++++++++++++++++++++++++++++++++++++++++++++++++++++
             Experiment start time: 2026-01-16 13:48:21.927382
++++++++++++++++++++++++++++++++++++++++++++++++++++++++++++++++++++++++++++++++
Repeating experiment config: 
       'experiments/linkpred_rice_node2vec_skip.yml' 
5 times and averaging results
================================================================================
                        Performing experiment trial 1/5
================================================================================
loaded graph: data/dgl_graphs/rice/graph.bin
saved graph
Graph on device: cpu
graph shape, num_nodes=439, num_edges=19320
using prior edge weights without reweighting..
absolute difference between median of weights after reweighting: 0.0
generating node embeddings..
training on device: cpu
training node2vec model with : adam, lr=0.025, batch_size=32
saving embedding file to /local/hase/crosswalk-reproduction/results/experiment_69_linkpred_rice_node2vec_skip/embeddings/emb_0_node2vec_ed32_wl40_cs10_wpn80_nns5.pt
performing link prediction task..
Edge type 0 has accuracy: 64.38044713906783
Edge type 1 has accuracy: 58.139534883720934
Edge type 2 has accuracy: 63.730569948186535
Accuracy: 62.68115942028986
Disparity: 7.847888803805628
================================================================================
                        Performing experiment trial 2/5
================================================================================
loaded graph: data/dgl_graphs/rice/graph.bin
saved graph
Graph on device: cpu
graph shape, num_nodes=439, num_edges=19320
using prior edge weights without reweighting..
absolute difference between median of weights after reweighting: 0.0
generating node embeddings..
training on device: cpu
training node2vec model with : adam, lr=0.025, batch_size=32
saving embedding file to /local/hase/crosswalk-reproduction/results/experiment_69_linkpred_rice_node2vec_skip/embeddings/emb_1_node2vec_ed32_wl40_cs10_wpn80_nns5.pt
performing link prediction task..
Edge type 0 has accuracy: 64.37523737181921
Edge type 1 has accuracy: 59.32692307692308
Edge type 2 has accuracy: 58.1151832460733
Accuracy: 62.70703933747412
Disparity: 7.349118699443206
================================================================================
                        Performing experiment trial 3/5
================================================================================
loaded graph: data/dgl_graphs/rice/graph.bin
saved graph
Graph on device: cpu
graph shape, num_nodes=439, num_edges=19320
using prior edge weights without reweighting..
absolute difference between median of weights after reweighting: 0.0
generating node embeddings..
training on device: cpu
training node2vec model with : adam, lr=0.025, batch_size=32
saving embedding file to /local/hase/crosswalk-reproduction/results/experiment_69_linkpred_rice_node2vec_skip/embeddings/emb_2_node2vec_ed32_wl40_cs10_wpn80_nns5.pt
performing link prediction task..
Edge type 0 has accuracy: 65.38753799392097
Edge type 1 has accuracy: 57.56704980842912
Edge type 2 has accuracy: 57.97872340425532
Accuracy: 62.914078674948236
Disparity: 12.913338248106754
================================================================================
                        Performing experiment trial 4/5
================================================================================
loaded graph: data/dgl_graphs/rice/graph.bin
saved graph
Graph on device: cpu
graph shape, num_nodes=439, num_edges=19320
using prior edge weights without reweighting..
absolute difference between median of weights after reweighting: 0.0
generating node embeddings..
training on device: cpu
training node2vec model with : adam, lr=0.025, batch_size=32
saving embedding file to /local/hase/crosswalk-reproduction/results/experiment_69_linkpred_rice_node2vec_skip/embeddings/emb_3_node2vec_ed32_wl40_cs10_wpn80_nns5.pt
performing link prediction task..
Edge type 0 has accuracy: 63.667425968109335
Edge type 1 has accuracy: 59.53757225433526
Edge type 2 has accuracy: 56.770833333333336
Accuracy: 62.215320910973084
Disparity: 8.03039176935633
================================================================================
                        Performing experiment trial 5/5
================================================================================
loaded graph: data/dgl_graphs/rice/graph.bin
saved graph
Graph on device: cpu
graph shape, num_nodes=439, num_edges=19320
using prior edge weights without reweighting..
absolute difference between median of weights after reweighting: 0.0
generating node embeddings..
training on device: cpu
training node2vec model with : adam, lr=0.025, batch_size=32
saving embedding file to /local/hase/crosswalk-reproduction/results/experiment_69_linkpred_rice_node2vec_skip/embeddings/emb_4_node2vec_ed32_wl40_cs10_wpn80_nns5.pt
performing link prediction task..
Edge type 0 has accuracy: 63.90577507598785
Edge type 1 has accuracy: 59.28777670837344
Edge type 2 has accuracy: 64.24870466321244
Accuracy: 62.68115942028986
Disparity: 5.117146199798481
================================================================================
results for task link prediciton
--------------------------------------------------------------------------------
run 0:
    accuracy: 62.68115942028986
    disparity: 7.847888803805628
--------------------------------------------------------------------------------
run 1:
    accuracy: 62.70703933747412
    disparity: 7.349118699443206
--------------------------------------------------------------------------------
run 2:
    accuracy: 62.914078674948236
    disparity: 12.913338248106754
--------------------------------------------------------------------------------
run 3:
    accuracy: 62.215320910973084
    disparity: 8.03039176935633
--------------------------------------------------------------------------------
run 4:
    accuracy: 62.68115942028986
    disparity: 5.117146199798481
================================================================================
final average of all runs:
    accuracy: 62.63975155279503
    disparity: 8.25157674410208

final std/var of all runs:
    accuracy: std=0.22950102771630784, var=0.052670721722841506
    disparity: std=2.5527629120561457, var=6.516598485169373
--------------------------------------------------------------------------------
accuracy values raw:
[62.68115942028986, 62.70703933747412, 62.914078674948236, 62.215320910973084, 62.68115942028986]
disparity values raw:
[7.847888803805628, 7.349118699443206, 12.913338248106754, 8.03039176935633, 5.117146199798481]
================================================================================
++++++++++++++++++++++++++++++++++++++++++++++++++++++++++++++++++++++++++++++++
             Experiment end time: 2026-01-16 13:52:09.797796
++++++++++++++++++++++++++++++++++++++++++++++++++++++++++++++++++++++++++++++++
