================================================================================
--------------------------------------------------------------------------------
|                         CROSSWALK REPRODUCTION SUITE                         |
--------------------------------------------------------------------------------
================================================================================
++++++++++++++++++++++++++++++++++++++++++++++++++++++++++++++++++++++++++++++++
             Experiment start time: 2026-01-23 16:03:47.401756
++++++++++++++++++++++++++++++++++++++++++++++++++++++++++++++++++++++++++++++++
Repeating experiment config: 
       'experiments/nodeclass_deepwalk_degree.yml' 
5 times and averaging results
================================================================================
                        Performing experiment trial 1/5
================================================================================
loaded graph: data/dgl_graphs/rice/graph.bin
saved graph
Graph on device: cpu
graph shape, num_nodes=439, num_edges=19320
performing edge reweighting with degree and fairwalk
absolute difference between median of weights after reweighting: 0.0028603896498680115
generating node embeddings..
training on device: cuda
training deepwalk model with : adam, lr=0.025, batch_size=32
saving embedding file to /local/hase/crosswalk-reproduction/results/experiment_111_nodeclass_rice_deepwalk_fair-degree/embeddings/emb_0_deepwalk_ed32_wl40_cs5_wpn80_nns5.pt
performing node classification task..
accuracy for group 0.0: 40.35087719298245
accuracy for group 1.0: 38.775510204081634
Mean weighted accuracy: 40.0
Disparity: 0.6204452874296074
================================================================================
                        Performing experiment trial 2/5
================================================================================
loaded graph: data/dgl_graphs/rice/graph.bin
saved graph
Graph on device: cpu
graph shape, num_nodes=439, num_edges=19320
performing edge reweighting with degree and fairwalk
absolute difference between median of weights after reweighting: 0.0028603896498680115
generating node embeddings..
training on device: cuda
training deepwalk model with : adam, lr=0.025, batch_size=32
saving embedding file to /local/hase/crosswalk-reproduction/results/experiment_111_nodeclass_rice_deepwalk_fair-degree/embeddings/emb_1_deepwalk_ed32_wl40_cs5_wpn80_nns5.pt
performing node classification task..
accuracy for group 0.0: 34.319526627218934
accuracy for group 1.0: 39.21568627450981
Mean weighted accuracy: 35.45454545454545
Disparity: 5.99309482293987
================================================================================
                        Performing experiment trial 3/5
================================================================================
loaded graph: data/dgl_graphs/rice/graph.bin
saved graph
Graph on device: cpu
graph shape, num_nodes=439, num_edges=19320
performing edge reweighting with degree and fairwalk
absolute difference between median of weights after reweighting: 0.0028603896498680115
generating node embeddings..
training on device: cuda
training deepwalk model with : adam, lr=0.025, batch_size=32
saving embedding file to /local/hase/crosswalk-reproduction/results/experiment_111_nodeclass_rice_deepwalk_fair-degree/embeddings/emb_2_deepwalk_ed32_wl40_cs5_wpn80_nns5.pt
performing node classification task..
accuracy for group 0.0: 43.373493975903614
accuracy for group 1.0: 35.18518518518518
Mean weighted accuracy: 41.36363636363637
Disparity: 16.762100213039183
================================================================================
                        Performing experiment trial 4/5
================================================================================
loaded graph: data/dgl_graphs/rice/graph.bin
saved graph
Graph on device: cpu
graph shape, num_nodes=439, num_edges=19320
performing edge reweighting with degree and fairwalk
absolute difference between median of weights after reweighting: 0.0028603896498680115
generating node embeddings..
training on device: cuda
training deepwalk model with : adam, lr=0.025, batch_size=32
saving embedding file to /local/hase/crosswalk-reproduction/results/experiment_111_nodeclass_rice_deepwalk_fair-degree/embeddings/emb_3_deepwalk_ed32_wl40_cs5_wpn80_nns5.pt
performing node classification task..
accuracy for group 0.0: 43.35260115606936
accuracy for group 1.0: 51.06382978723404
Mean weighted accuracy: 45.0
Disparity: 14.865761750523475
================================================================================
                        Performing experiment trial 5/5
================================================================================
loaded graph: data/dgl_graphs/rice/graph.bin
saved graph
Graph on device: cpu
graph shape, num_nodes=439, num_edges=19320
performing edge reweighting with degree and fairwalk
absolute difference between median of weights after reweighting: 0.0028603896498680115
generating node embeddings..
training on device: cuda
training deepwalk model with : adam, lr=0.025, batch_size=32
saving embedding file to /local/hase/crosswalk-reproduction/results/experiment_111_nodeclass_rice_deepwalk_fair-degree/embeddings/emb_4_deepwalk_ed32_wl40_cs5_wpn80_nns5.pt
performing node classification task..
accuracy for group 0.0: 46.82080924855491
accuracy for group 1.0: 36.17021276595745
Mean weighted accuracy: 44.54545454545455
Disparity: 28.35880135877933
================================================================================
results for task node classification
--------------------------------------------------------------------------------
run 0:
    accuracy: 40.0
    disparity: 0.6204452874296074
--------------------------------------------------------------------------------
run 1:
    accuracy: 35.45454545454545
    disparity: 5.99309482293987
--------------------------------------------------------------------------------
run 2:
    accuracy: 41.36363636363637
    disparity: 16.762100213039183
--------------------------------------------------------------------------------
run 3:
    accuracy: 45.0
    disparity: 14.865761750523475
--------------------------------------------------------------------------------
run 4:
    accuracy: 44.54545454545455
    disparity: 28.35880135877933
================================================================================
final average of all runs:
    accuracy: 41.27272727272727
    disparities: 13.320040686542294

final std/var of all runs:
    accuracy: std=3.466486539079568, var=12.01652892561984
    disparity: std=9.543219676165181, var=91.07304178754626
--------------------------------------------------------------------------------
accuracy values raw:
[40.0, 35.45454545454545, 41.36363636363637, 45.0, 44.54545454545455]
disparity values raw:
[0.6204452874296074, 5.99309482293987, 16.762100213039183, 14.865761750523475, 28.35880135877933]
================================================================================
++++++++++++++++++++++++++++++++++++++++++++++++++++++++++++++++++++++++++++++++
             Experiment end time: 2026-01-23 16:05:06.203988
++++++++++++++++++++++++++++++++++++++++++++++++++++++++++++++++++++++++++++++++
