================================================================================
--------------------------------------------------------------------------------
|                         CROSSWALK REPRODUCTION SUITE                         |
--------------------------------------------------------------------------------
================================================================================
++++++++++++++++++++++++++++++++++++++++++++++++++++++++++++++++++++++++++++++++
             Experiment start time: 2026-01-17 18:01:59.788401
++++++++++++++++++++++++++++++++++++++++++++++++++++++++++++++++++++++++++++++++
Repeating experiment config: 
       'experiments/linkpred_rice_node2vec_skip.yml' 
5 times and averaging results
================================================================================
                        Performing experiment trial 1/5
================================================================================
loaded graph: data/dgl_graphs/deezer/graph.bin
saved graph
Graph on device: cpu
graph shape, num_nodes=28281, num_edges=185504
using prior edge weights without reweighting..
absolute difference between median of weights after reweighting: 0.0
generating node embeddings..
training on device: cpu
training node2vec model with : adam, lr=0.025, batch_size=32
saving embedding file to /local/hase/crosswalk-reproduction/results/experiment_98_linkpred_deezer_node2vec_skip/embeddings/emb_0_node2vec_ed32_wl40_cs10_wpn80_nns5.pt
performing link prediction task..
Edge type 0 has accuracy: 85.04524128686327
Edge type 1 has accuracy: 85.0600266785238
Edge type 2 has accuracy: 86.53470867019793
Accuracy: 85.34041291574577
Disparity: 0.4881576300435917
================================================================================
                        Performing experiment trial 2/5
================================================================================
loaded graph: data/dgl_graphs/deezer/graph.bin
saved graph
Graph on device: cpu
graph shape, num_nodes=28281, num_edges=185504
using prior edge weights without reweighting..
absolute difference between median of weights after reweighting: 0.0
generating node embeddings..
training on device: cpu
training node2vec model with : adam, lr=0.025, batch_size=32
saving embedding file to /local/hase/crosswalk-reproduction/results/experiment_98_linkpred_deezer_node2vec_skip/embeddings/emb_1_node2vec_ed32_wl40_cs10_wpn80_nns5.pt
performing link prediction task..
Edge type 0 has accuracy: 85.73586172176539
Edge type 1 has accuracy: 85.6833092405204
Edge type 2 has accuracy: 86.96860238955266
Accuracy: 85.94954449894885
Disparity: 0.3527099773612066
================================================================================
                        Performing experiment trial 3/5
================================================================================
loaded graph: data/dgl_graphs/deezer/graph.bin
saved graph
Graph on device: cpu
graph shape, num_nodes=28281, num_edges=185504
using prior edge weights without reweighting..
absolute difference between median of weights after reweighting: 0.0
generating node embeddings..
training on device: cpu
training node2vec model with : adam, lr=0.025, batch_size=32
saving embedding file to /local/hase/crosswalk-reproduction/results/experiment_98_linkpred_deezer_node2vec_skip/embeddings/emb_2_node2vec_ed32_wl40_cs10_wpn80_nns5.pt
performing link prediction task..
Edge type 0 has accuracy: 84.95982591228658
Edge type 1 has accuracy: 84.64363211483892
Edge type 2 has accuracy: 86.58961147472498
Accuracy: 85.12209584388982
Disparity: 0.7270016851310612
================================================================================
                        Performing experiment trial 4/5
================================================================================
loaded graph: data/dgl_graphs/deezer/graph.bin
saved graph
Graph on device: cpu
graph shape, num_nodes=28281, num_edges=185504
using prior edge weights without reweighting..
absolute difference between median of weights after reweighting: 0.0
generating node embeddings..
training on device: cpu
training node2vec model with : adam, lr=0.025, batch_size=32
saving embedding file to /local/hase/crosswalk-reproduction/results/experiment_98_linkpred_deezer_node2vec_skip/embeddings/emb_3_node2vec_ed32_wl40_cs10_wpn80_nns5.pt
performing link prediction task..
Edge type 0 has accuracy: 84.97066219614418
Edge type 1 has accuracy: 85.19959968864671
Edge type 2 has accuracy: 86.69635402170887
Accuracy: 85.41588054552315
Disparity: 0.585633131759389
================================================================================
                        Performing experiment trial 5/5
================================================================================
loaded graph: data/dgl_graphs/deezer/graph.bin
saved graph
Graph on device: cpu
graph shape, num_nodes=28281, num_edges=185504
using prior edge weights without reweighting..
absolute difference between median of weights after reweighting: 0.0
generating node embeddings..
training on device: cpu
training node2vec model with : adam, lr=0.025, batch_size=32
saving embedding file to /local/hase/crosswalk-reproduction/results/experiment_98_linkpred_deezer_node2vec_skip/embeddings/emb_4_node2vec_ed32_wl40_cs10_wpn80_nns5.pt
performing link prediction task..
Edge type 0 has accuracy: 85.08536993639103
Edge type 1 has accuracy: 85.58248110271232
Edge type 2 has accuracy: 86.58196034627198
Accuracy: 85.61533070993478
Disparity: 0.3873179027706158
================================================================================
results for task link prediciton
--------------------------------------------------------------------------------
run 0:
    accuracy: 85.34041291574577
    disparity: 0.4881576300435917
--------------------------------------------------------------------------------
run 1:
    accuracy: 85.94954449894885
    disparity: 0.3527099773612066
--------------------------------------------------------------------------------
run 2:
    accuracy: 85.12209584388982
    disparity: 0.7270016851310612
--------------------------------------------------------------------------------
run 3:
    accuracy: 85.41588054552315
    disparity: 0.585633131759389
--------------------------------------------------------------------------------
run 4:
    accuracy: 85.61533070993478
    disparity: 0.3873179027706158
================================================================================
final average of all runs:
    accuracy: 85.48865290280847
    disparity: 0.5081640654131728

final std/var of all runs:
    accuracy: std=0.2793217919903349, var=0.07802066348069193
    disparity: std=0.13642681995710568, var=0.01861227720360853
--------------------------------------------------------------------------------
accuracy values raw:
[85.34041291574577, 85.94954449894885, 85.12209584388982, 85.41588054552315, 85.61533070993478]
disparity values raw:
[0.4881576300435917, 0.3527099773612066, 0.7270016851310612, 0.585633131759389, 0.3873179027706158]
================================================================================
++++++++++++++++++++++++++++++++++++++++++++++++++++++++++++++++++++++++++++++++
             Experiment end time: 2026-01-17 19:15:24.238632
++++++++++++++++++++++++++++++++++++++++++++++++++++++++++++++++++++++++++++++++
