================================================================================
--------------------------------------------------------------------------------
|                         CROSSWALK REPRODUCTION SUITE                         |
--------------------------------------------------------------------------------
================================================================================
++++++++++++++++++++++++++++++++++++++++++++++++++++++++++++++++++++++++++++++++
             Experiment start time: 2026-01-17 09:28:11.955461
++++++++++++++++++++++++++++++++++++++++++++++++++++++++++++++++++++++++++++++++
Repeating experiment config: 
       'experiments/linkpred_rice_node2vec_skip.yml' 
5 times and averaging results
================================================================================
                        Performing experiment trial 1/5
================================================================================
loaded graph: data/dgl_graphs/deezer/graph.bin
saved graph
Graph on device: cpu
graph shape, num_nodes=28281, num_edges=185504
using prior edge weights without reweighting..
absolute difference between median of weights after reweighting: 0.0
generating node embeddings..
training on device: cpu
training node2vec model with : adam, lr=0.025, batch_size=32
saving embedding file to /local/hase/crosswalk-reproduction/results/experiment_91_linkpred_deezer_node2vec_skip/embeddings/emb_0_node2vec_ed32_wl40_cs10_wpn80_nns5.pt
performing link prediction task..
Edge type 0 has accuracy: 84.24932975871313
Edge type 1 has accuracy: 85.04335260115607
Edge type 2 has accuracy: 86.66016169500975
Accuracy: 85.10053366395343
Disparity: 1.0062949494840896
================================================================================
                        Performing experiment trial 2/5
================================================================================
loaded graph: data/dgl_graphs/deezer/graph.bin
saved graph
Graph on device: cpu
graph shape, num_nodes=28281, num_edges=185504
using prior edge weights without reweighting..
absolute difference between median of weights after reweighting: 0.0
generating node embeddings..
training on device: cpu
training node2vec model with : adam, lr=0.025, batch_size=32
saving embedding file to /local/hase/crosswalk-reproduction/results/experiment_91_linkpred_deezer_node2vec_skip/embeddings/emb_1_node2vec_ed32_wl40_cs10_wpn80_nns5.pt
performing link prediction task..
Edge type 0 has accuracy: 84.61151199865749
Edge type 1 has accuracy: 84.71673986768221
Edge type 2 has accuracy: 86.35542587189107
Accuracy: 85.0008085817476
Disparity: 0.6375111468962272
================================================================================
                        Performing experiment trial 3/5
================================================================================
loaded graph: data/dgl_graphs/deezer/graph.bin
saved graph
Graph on device: cpu
graph shape, num_nodes=28281, num_edges=185504
using prior edge weights without reweighting..
absolute difference between median of weights after reweighting: 0.0
generating node embeddings..
training on device: cpu
training node2vec model with : adam, lr=0.025, batch_size=32
saving embedding file to /local/hase/crosswalk-reproduction/results/experiment_91_linkpred_deezer_node2vec_skip/embeddings/emb_2_node2vec_ed32_wl40_cs10_wpn80_nns5.pt
performing link prediction task..
Edge type 0 has accuracy: 84.44091061265485
Edge type 1 has accuracy: 84.82470784641069
Edge type 2 has accuracy: 85.69042316258351
Accuracy: 84.86874022963721
Disparity: 0.2731161041915656
================================================================================
                        Performing experiment trial 4/5
================================================================================
loaded graph: data/dgl_graphs/deezer/graph.bin
saved graph
Graph on device: cpu
graph shape, num_nodes=28281, num_edges=185504
using prior edge weights without reweighting..
absolute difference between median of weights after reweighting: 0.0
generating node embeddings..
training on device: cpu
training node2vec model with : adam, lr=0.025, batch_size=32
saving embedding file to /local/hase/crosswalk-reproduction/results/experiment_91_linkpred_deezer_node2vec_skip/embeddings/emb_3_node2vec_ed32_wl40_cs10_wpn80_nns5.pt
performing link prediction task..
Edge type 0 has accuracy: 84.56572769953051
Edge type 1 has accuracy: 84.57476375764314
Edge type 2 has accuracy: 86.28897550111358
Accuracy: 84.90377877203386
Disparity: 0.6564651708287864
================================================================================
                        Performing experiment trial 5/5
================================================================================
loaded graph: data/dgl_graphs/deezer/graph.bin
saved graph
Graph on device: cpu
graph shape, num_nodes=28281, num_edges=185504
using prior edge weights without reweighting..
absolute difference between median of weights after reweighting: 0.0
generating node embeddings..
training on device: cpu
training node2vec model with : adam, lr=0.025, batch_size=32
saving embedding file to /local/hase/crosswalk-reproduction/results/experiment_91_linkpred_deezer_node2vec_skip/embeddings/emb_4_node2vec_ed32_wl40_cs10_wpn80_nns5.pt
performing link prediction task..
Edge type 0 has accuracy: 85.63896560381622
Edge type 1 has accuracy: 84.74152306837132
Edge type 2 has accuracy: 86.4302666480525
Accuracy: 85.35658455069807
Disparity: 0.4759350361055075
================================================================================
results for task link prediciton
--------------------------------------------------------------------------------
run 0:
    accuracy: 85.10053366395343
    disparity: 1.0062949494840896
--------------------------------------------------------------------------------
run 1:
    accuracy: 85.0008085817476
    disparity: 0.6375111468962272
--------------------------------------------------------------------------------
run 2:
    accuracy: 84.86874022963721
    disparity: 0.2731161041915656
--------------------------------------------------------------------------------
run 3:
    accuracy: 84.90377877203386
    disparity: 0.6564651708287864
--------------------------------------------------------------------------------
run 4:
    accuracy: 85.35658455069807
    disparity: 0.4759350361055075
================================================================================
final average of all runs:
    accuracy: 85.04608915961404
    disparity: 0.6098644815012353

final std/var of all runs:
    accuracy: std=0.17500103545193893, var=0.03062536240925079
    disparity: std=0.24142478922557778, var=0.05828592885261465
--------------------------------------------------------------------------------
accuracy values raw:
[85.10053366395343, 85.0008085817476, 84.86874022963721, 84.90377877203386, 85.35658455069807]
disparity values raw:
[1.0062949494840896, 0.6375111468962272, 0.2731161041915656, 0.6564651708287864, 0.4759350361055075]
================================================================================
++++++++++++++++++++++++++++++++++++++++++++++++++++++++++++++++++++++++++++++++
             Experiment end time: 2026-01-17 10:40:37.984090
++++++++++++++++++++++++++++++++++++++++++++++++++++++++++++++++++++++++++++++++
