================================================================================
--------------------------------------------------------------------------------
|                         CROSSWALK REPRODUCTION SUITE                         |
--------------------------------------------------------------------------------
================================================================================
++++++++++++++++++++++++++++++++++++++++++++++++++++++++++++++++++++++++++++++++
             Experiment start time: 2026-01-17 06:58:47.346904
++++++++++++++++++++++++++++++++++++++++++++++++++++++++++++++++++++++++++++++++
Repeating experiment config: 
       'experiments/linkpred_rice_node2vec_skip.yml' 
5 times and averaging results
================================================================================
                        Performing experiment trial 1/5
================================================================================
loaded graph: data/dgl_graphs/deezer/graph.bin
saved graph
Graph on device: cpu
graph shape, num_nodes=28281, num_edges=185504
using prior edge weights without reweighting..
absolute difference between median of weights after reweighting: 0.0
generating node embeddings..
training on device: cpu
training node2vec model with : adam, lr=0.025, batch_size=32
saving embedding file to /local/hase/crosswalk-reproduction/results/experiment_89_linkpred_deezer_node2vec_skip/embeddings/emb_0_node2vec_ed32_wl40_cs10_wpn80_nns5.pt
performing link prediction task..
Edge type 0 has accuracy: 85.17091152815014
Edge type 1 has accuracy: 85.88261449533125
Edge type 2 has accuracy: 87.83105659325342
Accuracy: 86.03040267371031
Disparity: 1.2643688322047852
================================================================================
                        Performing experiment trial 2/5
================================================================================
loaded graph: data/dgl_graphs/deezer/graph.bin
saved graph
Graph on device: cpu
graph shape, num_nodes=28281, num_edges=185504
using prior edge weights without reweighting..
absolute difference between median of weights after reweighting: 0.0
generating node embeddings..
training on device: cpu
training node2vec model with : adam, lr=0.025, batch_size=32
saving embedding file to /local/hase/crosswalk-reproduction/results/experiment_89_linkpred_deezer_node2vec_skip/embeddings/emb_1_node2vec_ed32_wl40_cs10_wpn80_nns5.pt
performing link prediction task..
Edge type 0 has accuracy: 86.155395200537
Edge type 1 has accuracy: 86.22817747136662
Edge type 2 has accuracy: 87.38538482911919
Accuracy: 86.42930300253356
Disparity: 0.3174778460226164
================================================================================
                        Performing experiment trial 3/5
================================================================================
loaded graph: data/dgl_graphs/deezer/graph.bin
saved graph
Graph on device: cpu
graph shape, num_nodes=28281, num_edges=185504
using prior edge weights without reweighting..
absolute difference between median of weights after reweighting: 0.0
generating node embeddings..
training on device: cpu
training node2vec model with : adam, lr=0.025, batch_size=32
saving embedding file to /local/hase/crosswalk-reproduction/results/experiment_89_linkpred_deezer_node2vec_skip/embeddings/emb_2_node2vec_ed32_wl40_cs10_wpn80_nns5.pt
performing link prediction task..
Edge type 0 has accuracy: 85.34482758620689
Edge type 1 has accuracy: 85.59505925554998
Edge type 2 has accuracy: 86.75671911989974
Accuracy: 85.73931324456903
Disparity: 0.37838969241076503
================================================================================
                        Performing experiment trial 4/5
================================================================================
loaded graph: data/dgl_graphs/deezer/graph.bin
saved graph
Graph on device: cpu
graph shape, num_nodes=28281, num_edges=185504
using prior edge weights without reweighting..
absolute difference between median of weights after reweighting: 0.0
generating node embeddings..
training on device: cpu
training node2vec model with : adam, lr=0.025, batch_size=32
saving embedding file to /local/hase/crosswalk-reproduction/results/experiment_89_linkpred_deezer_node2vec_skip/embeddings/emb_3_node2vec_ed32_wl40_cs10_wpn80_nns5.pt
performing link prediction task..
Edge type 0 has accuracy: 85.39815590947192
Edge type 1 has accuracy: 85.74446791949293
Edge type 2 has accuracy: 87.54522682994713
Accuracy: 85.98188776885343
Disparity: 0.8858420221572431
================================================================================
                        Performing experiment trial 5/5
================================================================================
loaded graph: data/dgl_graphs/deezer/graph.bin
saved graph
Graph on device: cpu
graph shape, num_nodes=28281, num_edges=185504
using prior edge weights without reweighting..
absolute difference between median of weights after reweighting: 0.0
generating node embeddings..
training on device: cpu
training node2vec model with : adam, lr=0.025, batch_size=32
saving embedding file to /local/hase/crosswalk-reproduction/results/experiment_89_linkpred_deezer_node2vec_skip/embeddings/emb_4_node2vec_ed32_wl40_cs10_wpn80_nns5.pt
performing link prediction task..
Edge type 0 has accuracy: 85.28624037495815
Edge type 1 has accuracy: 85.96042685638061
Edge type 2 has accuracy: 87.5733035464954
Accuracy: 86.05466012613874
Disparity: 0.9207285088722674
================================================================================
results for task link prediciton
--------------------------------------------------------------------------------
run 0:
    accuracy: 86.03040267371031
    disparity: 1.2643688322047852
--------------------------------------------------------------------------------
run 1:
    accuracy: 86.42930300253356
    disparity: 0.3174778460226164
--------------------------------------------------------------------------------
run 2:
    accuracy: 85.73931324456903
    disparity: 0.37838969241076503
--------------------------------------------------------------------------------
run 3:
    accuracy: 85.98188776885343
    disparity: 0.8858420221572431
--------------------------------------------------------------------------------
run 4:
    accuracy: 86.05466012613874
    disparity: 0.9207285088722674
================================================================================
final average of all runs:
    accuracy: 86.047113363161
    disparity: 0.7533613803335355

final std/var of all runs:
    accuracy: std=0.2215402502368773, var=0.04908008247501821
    disparity: std=0.35701252478541967, var=0.12745794285365988
--------------------------------------------------------------------------------
accuracy values raw:
[86.03040267371031, 86.42930300253356, 85.73931324456903, 85.98188776885343, 86.05466012613874]
disparity values raw:
[1.2643688322047852, 0.3174778460226164, 0.37838969241076503, 0.8858420221572431, 0.9207285088722674]
================================================================================
++++++++++++++++++++++++++++++++++++++++++++++++++++++++++++++++++++++++++++++++
             Experiment end time: 2026-01-17 08:13:46.204663
++++++++++++++++++++++++++++++++++++++++++++++++++++++++++++++++++++++++++++++++
