================================================================================
--------------------------------------------------------------------------------
|                         CROSSWALK REPRODUCTION SUITE                         |
--------------------------------------------------------------------------------
================================================================================
++++++++++++++++++++++++++++++++++++++++++++++++++++++++++++++++++++++++++++++++
             Experiment start time: 2026-01-16 12:12:46.591150
++++++++++++++++++++++++++++++++++++++++++++++++++++++++++++++++++++++++++++++++
Repeating experiment config: 
       'experiments/linkpred_rice_node2vec_skip.yml' 
5 times and averaging results
================================================================================
                        Performing experiment trial 1/5
================================================================================
loaded graph: data/dgl_graphs/rice/graph.bin
saved graph
Graph on device: cpu
graph shape, num_nodes=439, num_edges=19320
using prior edge weights without reweighting..
absolute difference between median of weights after reweighting: 0.0
generating node embeddings..
training on device: cpu
training node2vec model with : adam, lr=0.025, batch_size=32
saving embedding file to /local/hase/crosswalk-reproduction/results/experiment_56_linkpred_rice_node2vec_skip/embeddings/emb_0_node2vec_ed32_wl40_cs10_wpn80_nns5.pt
performing link prediction task..
Edge type 0 has accuracy: 56.68813944676013
Edge type 1 has accuracy: 52.42248062015504
Edge type 2 has accuracy: 55.95854922279793
Accuracy: 55.51242236024845
Disparity: 3.470214253610216
================================================================================
                        Performing experiment trial 2/5
================================================================================
loaded graph: data/dgl_graphs/rice/graph.bin
saved graph
Graph on device: cpu
graph shape, num_nodes=439, num_edges=19320
using prior edge weights without reweighting..
absolute difference between median of weights after reweighting: 0.0
generating node embeddings..
training on device: cpu
training node2vec model with : adam, lr=0.025, batch_size=32
saving embedding file to /local/hase/crosswalk-reproduction/results/experiment_56_linkpred_rice_node2vec_skip/embeddings/emb_1_node2vec_ed32_wl40_cs10_wpn80_nns5.pt
performing link prediction task..
Edge type 0 has accuracy: 56.09570831750854
Edge type 1 has accuracy: 50.816522574447646
Edge type 2 has accuracy: 54.736842105263165
Accuracy: 54.60662525879917
Disparity: 5.009469412912566
================================================================================
                        Performing experiment trial 3/5
================================================================================
loaded graph: data/dgl_graphs/rice/graph.bin
saved graph
Graph on device: cpu
graph shape, num_nodes=439, num_edges=19320
using prior edge weights without reweighting..
absolute difference between median of weights after reweighting: 0.0
generating node embeddings..
training on device: cpu
training node2vec model with : adam, lr=0.025, batch_size=32
saving embedding file to /local/hase/crosswalk-reproduction/results/experiment_56_linkpred_rice_node2vec_skip/embeddings/emb_2_node2vec_ed32_wl40_cs10_wpn80_nns5.pt
performing link prediction task..
Edge type 0 has accuracy: 58.51063829787234
Edge type 1 has accuracy: 53.735632183908045
Edge type 2 has accuracy: 47.87234042553192
Accuracy: 56.70289855072463
Disparity: 18.928028361431178
================================================================================
                        Performing experiment trial 4/5
================================================================================
loaded graph: data/dgl_graphs/rice/graph.bin
saved graph
Graph on device: cpu
graph shape, num_nodes=439, num_edges=19320
using prior edge weights without reweighting..
absolute difference between median of weights after reweighting: 0.0
generating node embeddings..
training on device: cpu
training node2vec model with : adam, lr=0.025, batch_size=32
saving embedding file to /local/hase/crosswalk-reproduction/results/experiment_56_linkpred_rice_node2vec_skip/embeddings/emb_3_node2vec_ed32_wl40_cs10_wpn80_nns5.pt
performing link prediction task..
Edge type 0 has accuracy: 54.69046714774022
Edge type 1 has accuracy: 54.090471607314726
Edge type 2 has accuracy: 51.041666666666664
Accuracy: 54.347826086956516
Disparity: 2.552105685037015
================================================================================
                        Performing experiment trial 5/5
================================================================================
loaded graph: data/dgl_graphs/rice/graph.bin
saved graph
Graph on device: cpu
graph shape, num_nodes=439, num_edges=19320
using prior edge weights without reweighting..
absolute difference between median of weights after reweighting: 0.0
generating node embeddings..
training on device: cpu
training node2vec model with : adam, lr=0.025, batch_size=32
saving embedding file to /local/hase/crosswalk-reproduction/results/experiment_56_linkpred_rice_node2vec_skip/embeddings/emb_4_node2vec_ed32_wl40_cs10_wpn80_nns5.pt
performing link prediction task..
Edge type 0 has accuracy: 57.598784194528875
Edge type 1 has accuracy: 55.14918190567853
Edge type 2 has accuracy: 54.92227979274611
Accuracy: 56.8064182194617
Disparity: 1.4684124172396171
================================================================================
results for task link prediciton
--------------------------------------------------------------------------------
run 0:
    accuracy: 55.51242236024845
    disparity: 3.470214253610216
--------------------------------------------------------------------------------
run 1:
    accuracy: 54.60662525879917
    disparity: 5.009469412912566
--------------------------------------------------------------------------------
run 2:
    accuracy: 56.70289855072463
    disparity: 18.928028361431178
--------------------------------------------------------------------------------
run 3:
    accuracy: 54.347826086956516
    disparity: 2.552105685037015
--------------------------------------------------------------------------------
run 4:
    accuracy: 56.8064182194617
    disparity: 1.4684124172396171
================================================================================
final average of all runs:
    accuracy: 55.595238095238095
    disparity: 6.285646026046118

final std/var of all runs:
    accuracy: std=1.023144123054198, var=1.046823896540344
    disparity: std=6.4269771595512, var=41.30603540939281
--------------------------------------------------------------------------------
accuracy values raw:
[55.51242236024845, 54.60662525879917, 56.70289855072463, 54.347826086956516, 56.8064182194617]
disparity values raw:
[3.470214253610216, 5.009469412912566, 18.928028361431178, 2.552105685037015, 1.4684124172396171]
================================================================================
++++++++++++++++++++++++++++++++++++++++++++++++++++++++++++++++++++++++++++++++
             Experiment end time: 2026-01-16 12:15:41.509422
++++++++++++++++++++++++++++++++++++++++++++++++++++++++++++++++++++++++++++++++
