================================================================================
--------------------------------------------------------------------------------
|                         CROSSWALK REPRODUCTION SUITE                         |
--------------------------------------------------------------------------------
================================================================================
++++++++++++++++++++++++++++++++++++++++++++++++++++++++++++++++++++++++++++++++
             Experiment start time: 2026-01-16 12:18:43.112715
++++++++++++++++++++++++++++++++++++++++++++++++++++++++++++++++++++++++++++++++
Repeating experiment config: 
       'experiments/linkpred_rice_node2vec_skip.yml' 
5 times and averaging results
================================================================================
                        Performing experiment trial 1/5
================================================================================
loaded graph: data/dgl_graphs/rice/graph.bin
saved graph
Graph on device: cpu
graph shape, num_nodes=439, num_edges=19320
using prior edge weights without reweighting..
absolute difference between median of weights after reweighting: 0.0
generating node embeddings..
training on device: cpu
training node2vec model with : adam, lr=0.025, batch_size=32
saving embedding file to /local/hase/crosswalk-reproduction/results/experiment_58_linkpred_rice_node2vec_skip/embeddings/emb_0_node2vec_ed32_wl40_cs10_wpn80_nns5.pt
performing link prediction task..
Edge type 0 has accuracy: 57.597574838954145
Edge type 1 has accuracy: 53.39147286821705
Edge type 2 has accuracy: 57.51295336787565
Accuracy: 56.469979296066256
Disparity: 3.8538951211857877
================================================================================
                        Performing experiment trial 2/5
================================================================================
loaded graph: data/dgl_graphs/rice/graph.bin
saved graph
Graph on device: cpu
graph shape, num_nodes=439, num_edges=19320
using prior edge weights without reweighting..
absolute difference between median of weights after reweighting: 0.0
generating node embeddings..
training on device: cpu
training node2vec model with : adam, lr=0.025, batch_size=32
saving embedding file to /local/hase/crosswalk-reproduction/results/experiment_58_linkpred_rice_node2vec_skip/embeddings/emb_1_node2vec_ed32_wl40_cs10_wpn80_nns5.pt
performing link prediction task..
Edge type 0 has accuracy: 56.74135966578048
Edge type 1 has accuracy: 52.44956772334294
Edge type 2 has accuracy: 51.578947368421055
Accuracy: 55.33126293995859
Disparity: 5.091995400833769
================================================================================
                        Performing experiment trial 3/5
================================================================================
loaded graph: data/dgl_graphs/rice/graph.bin
saved graph
Graph on device: cpu
graph shape, num_nodes=439, num_edges=19320
using prior edge weights without reweighting..
absolute difference between median of weights after reweighting: 0.0
generating node embeddings..
training on device: cpu
training node2vec model with : adam, lr=0.025, batch_size=32
saving embedding file to /local/hase/crosswalk-reproduction/results/experiment_58_linkpred_rice_node2vec_skip/embeddings/emb_2_node2vec_ed32_wl40_cs10_wpn80_nns5.pt
performing link prediction task..
Edge type 0 has accuracy: 59.787153173698215
Edge type 1 has accuracy: 53.735632183908045
Edge type 2 has accuracy: 52.910052910052904
Accuracy: 57.815734989648035
Disparity: 9.399666162613398
================================================================================
                        Performing experiment trial 4/5
================================================================================
loaded graph: data/dgl_graphs/rice/graph.bin
saved graph
Graph on device: cpu
graph shape, num_nodes=439, num_edges=19320
using prior edge weights without reweighting..
absolute difference between median of weights after reweighting: 0.0
generating node embeddings..
training on device: cpu
training node2vec model with : adam, lr=0.025, batch_size=32
saving embedding file to /local/hase/crosswalk-reproduction/results/experiment_58_linkpred_rice_node2vec_skip/embeddings/emb_3_node2vec_ed32_wl40_cs10_wpn80_nns5.pt
performing link prediction task..
Edge type 0 has accuracy: 56.28083491461101
Edge type 1 has accuracy: 53.42333654773385
Edge type 2 has accuracy: 57.8125
Accuracy: 55.590062111801245
Disparity: 3.308450073468251
================================================================================
                        Performing experiment trial 5/5
================================================================================
loaded graph: data/dgl_graphs/rice/graph.bin
saved graph
Graph on device: cpu
graph shape, num_nodes=439, num_edges=19320
using prior edge weights without reweighting..
absolute difference between median of weights after reweighting: 0.0
generating node embeddings..
training on device: cpu
training node2vec model with : adam, lr=0.025, batch_size=32
saving embedding file to /local/hase/crosswalk-reproduction/results/experiment_58_linkpred_rice_node2vec_skip/embeddings/emb_4_node2vec_ed32_wl40_cs10_wpn80_nns5.pt
performing link prediction task..
Edge type 0 has accuracy: 58.7386018237082
Edge type 1 has accuracy: 53.46153846153846
Edge type 2 has accuracy: 53.125
Accuracy: 57.039337474120074
Disparity: 6.608131255509882
================================================================================
results for task link prediciton
--------------------------------------------------------------------------------
run 0:
    accuracy: 56.469979296066256
    disparity: 3.8538951211857877
--------------------------------------------------------------------------------
run 1:
    accuracy: 55.33126293995859
    disparity: 5.091995400833769
--------------------------------------------------------------------------------
run 2:
    accuracy: 57.815734989648035
    disparity: 9.399666162613398
--------------------------------------------------------------------------------
run 3:
    accuracy: 55.590062111801245
    disparity: 3.308450073468251
--------------------------------------------------------------------------------
run 4:
    accuracy: 57.039337474120074
    disparity: 6.608131255509882
================================================================================
final average of all runs:
    accuracy: 56.449275362318836
    disparity: 5.652427602722217

final std/var of all runs:
    accuracy: std=0.9169528939038729, var=0.8408026096386871
    disparity: std=2.1908080835340034, var=4.799640058877933
--------------------------------------------------------------------------------
accuracy values raw:
[56.469979296066256, 55.33126293995859, 57.815734989648035, 55.590062111801245, 57.039337474120074]
disparity values raw:
[3.8538951211857877, 5.091995400833769, 9.399666162613398, 3.308450073468251, 6.608131255509882]
================================================================================
++++++++++++++++++++++++++++++++++++++++++++++++++++++++++++++++++++++++++++++++
             Experiment end time: 2026-01-16 12:21:37.769006
++++++++++++++++++++++++++++++++++++++++++++++++++++++++++++++++++++++++++++++++
