================================================================================
--------------------------------------------------------------------------------
|                         CROSSWALK REPRODUCTION SUITE                         |
--------------------------------------------------------------------------------
================================================================================
++++++++++++++++++++++++++++++++++++++++++++++++++++++++++++++++++++++++++++++++
             Experiment start time: 2026-01-17 02:04:46.261573
++++++++++++++++++++++++++++++++++++++++++++++++++++++++++++++++++++++++++++++++
Repeating experiment config: 
       'experiments/linkpred_rice_node2vec_skip.yml' 
5 times and averaging results
================================================================================
                        Performing experiment trial 1/5
================================================================================
loaded graph: data/dgl_graphs/deezer/graph.bin
saved graph
Graph on device: cpu
graph shape, num_nodes=28281, num_edges=185504
using prior edge weights without reweighting..
absolute difference between median of weights after reweighting: 0.0
generating node embeddings..
training on device: cpu
training node2vec model with : adam, lr=0.025, batch_size=32
saving embedding file to /local/hase/crosswalk-reproduction/results/experiment_85_linkpred_deezer_node2vec_skip/embeddings/emb_0_node2vec_ed32_wl40_cs10_wpn80_nns5.pt
performing link prediction task..
Edge type 0 has accuracy: 84.81903485254692
Edge type 1 has accuracy: 85.62694530902624
Edge type 2 has accuracy: 87.0783384443825
Accuracy: 85.64767397983937
Disparity: 0.8737460065698907
================================================================================
                        Performing experiment trial 2/5
================================================================================
loaded graph: data/dgl_graphs/deezer/graph.bin
saved graph
Graph on device: cpu
graph shape, num_nodes=28281, num_edges=185504
using prior edge weights without reweighting..
absolute difference between median of weights after reweighting: 0.0
generating node embeddings..
training on device: cpu
training node2vec model with : adam, lr=0.025, batch_size=32
saving embedding file to /local/hase/crosswalk-reproduction/results/experiment_85_linkpred_deezer_node2vec_skip/embeddings/emb_1_node2vec_ed32_wl40_cs10_wpn80_nns5.pt
performing link prediction task..
Edge type 0 has accuracy: 85.28992196022489
Edge type 1 has accuracy: 85.09479068215934
Edge type 2 has accuracy: 86.63517643789942
Accuracy: 85.45630963290388
Disparity: 0.46895267798553214
================================================================================
                        Performing experiment trial 3/5
================================================================================
loaded graph: data/dgl_graphs/deezer/graph.bin
saved graph
Graph on device: cpu
graph shape, num_nodes=28281, num_edges=185504
using prior edge weights without reweighting..
absolute difference between median of weights after reweighting: 0.0
generating node embeddings..
training on device: cpu
training node2vec model with : adam, lr=0.025, batch_size=32
saving embedding file to /local/hase/crosswalk-reproduction/results/experiment_85_linkpred_deezer_node2vec_skip/embeddings/emb_2_node2vec_ed32_wl40_cs10_wpn80_nns5.pt
performing link prediction task..
Edge type 0 has accuracy: 85.06738093245167
Edge type 1 has accuracy: 85.26596928555531
Edge type 2 has accuracy: 85.91117917304747
Accuracy: 85.32693655328553
Disparity: 0.12974762263762582
================================================================================
                        Performing experiment trial 4/5
================================================================================
loaded graph: data/dgl_graphs/deezer/graph.bin
saved graph
Graph on device: cpu
graph shape, num_nodes=28281, num_edges=185504
using prior edge weights without reweighting..
absolute difference between median of weights after reweighting: 0.0
generating node embeddings..
training on device: cpu
training node2vec model with : adam, lr=0.025, batch_size=32
saving embedding file to /local/hase/crosswalk-reproduction/results/experiment_85_linkpred_deezer_node2vec_skip/embeddings/emb_3_node2vec_ed32_wl40_cs10_wpn80_nns5.pt
performing link prediction task..
Edge type 0 has accuracy: 85.37178304971079
Edge type 1 has accuracy: 84.72314876584389
Edge type 2 has accuracy: 86.93110647181629
Accuracy: 85.35927982319012
Disparity: 0.8585881333663639
================================================================================
                        Performing experiment trial 5/5
================================================================================
loaded graph: data/dgl_graphs/deezer/graph.bin
saved graph
Graph on device: cpu
graph shape, num_nodes=28281, num_edges=185504
using prior edge weights without reweighting..
absolute difference between median of weights after reweighting: 0.0
generating node embeddings..
training on device: cpu
training node2vec model with : adam, lr=0.025, batch_size=32
saving embedding file to /local/hase/crosswalk-reproduction/results/experiment_85_linkpred_deezer_node2vec_skip/embeddings/emb_4_node2vec_ed32_wl40_cs10_wpn80_nns5.pt
performing link prediction task..
Edge type 0 has accuracy: 86.24152648757219
Edge type 1 has accuracy: 85.44191217342969
Edge type 2 has accuracy: 86.58383358927824
Accuracy: 85.91989650153631
Disparity: 0.22894908035928418
================================================================================
results for task link prediciton
--------------------------------------------------------------------------------
run 0:
    accuracy: 85.64767397983937
    disparity: 0.8737460065698907
--------------------------------------------------------------------------------
run 1:
    accuracy: 85.45630963290388
    disparity: 0.46895267798553214
--------------------------------------------------------------------------------
run 2:
    accuracy: 85.32693655328553
    disparity: 0.12974762263762582
--------------------------------------------------------------------------------
run 3:
    accuracy: 85.35927982319012
    disparity: 0.8585881333663639
--------------------------------------------------------------------------------
run 4:
    accuracy: 85.91989650153631
    disparity: 0.22894908035928418
================================================================================
final average of all runs:
    accuracy: 85.54201929815103
    disparity: 0.5119967041837393

final std/var of all runs:
    accuracy: std=0.21952427754833412, var=0.04819090843311803
    disparity: std=0.3095387802672198, var=0.09581425648931818
--------------------------------------------------------------------------------
accuracy values raw:
[85.64767397983937, 85.45630963290388, 85.32693655328553, 85.35927982319012, 85.91989650153631]
disparity values raw:
[0.8737460065698907, 0.46895267798553214, 0.12974762263762582, 0.8585881333663639, 0.22894908035928418]
================================================================================
++++++++++++++++++++++++++++++++++++++++++++++++++++++++++++++++++++++++++++++++
             Experiment end time: 2026-01-17 03:18:31.717420
++++++++++++++++++++++++++++++++++++++++++++++++++++++++++++++++++++++++++++++++
