================================================================================
--------------------------------------------------------------------------------
|                         CROSSWALK REPRODUCTION SUITE                         |
--------------------------------------------------------------------------------
================================================================================
++++++++++++++++++++++++++++++++++++++++++++++++++++++++++++++++++++++++++++++++
             Experiment start time: 2026-01-16 14:09:08.665071
++++++++++++++++++++++++++++++++++++++++++++++++++++++++++++++++++++++++++++++++
Repeating experiment config: 
       'experiments/linkpred_rice_node2vec_skip.yml' 
5 times and averaging results
================================================================================
                        Performing experiment trial 1/5
================================================================================
loaded graph: data/dgl_graphs/rice/graph.bin
saved graph
Graph on device: cpu
graph shape, num_nodes=439, num_edges=19320
using prior edge weights without reweighting..
absolute difference between median of weights after reweighting: 0.0
generating node embeddings..
training on device: cpu
training node2vec model with : adam, lr=0.025, batch_size=32
saving embedding file to /local/hase/crosswalk-reproduction/results/experiment_75_linkpred_rice_node2vec_skip/embeddings/emb_0_node2vec_ed32_wl40_cs10_wpn80_nns5.pt
performing link prediction task..
Edge type 0 has accuracy: 60.363774156877604
Edge type 1 has accuracy: 55.71705426356589
Edge type 2 has accuracy: 55.95854922279793
Accuracy: 58.90269151138716
Disparity: 4.561814700230064
================================================================================
                        Performing experiment trial 2/5
================================================================================
loaded graph: data/dgl_graphs/rice/graph.bin
saved graph
Graph on device: cpu
graph shape, num_nodes=439, num_edges=19320
using prior edge weights without reweighting..
absolute difference between median of weights after reweighting: 0.0
generating node embeddings..
training on device: cpu
training node2vec model with : adam, lr=0.025, batch_size=32
saving embedding file to /local/hase/crosswalk-reproduction/results/experiment_75_linkpred_rice_node2vec_skip/embeddings/emb_1_node2vec_ed32_wl40_cs10_wpn80_nns5.pt
performing link prediction task..
Edge type 0 has accuracy: 60.577288264337255
Edge type 1 has accuracy: 53.07692307692308
Edge type 2 has accuracy: 56.54450261780105
Accuracy: 58.35921325051759
Disparity: 9.39366065419982
================================================================================
                        Performing experiment trial 3/5
================================================================================
loaded graph: data/dgl_graphs/rice/graph.bin
saved graph
Graph on device: cpu
graph shape, num_nodes=439, num_edges=19320
using prior edge weights without reweighting..
absolute difference between median of weights after reweighting: 0.0
generating node embeddings..
training on device: cpu
training node2vec model with : adam, lr=0.025, batch_size=32
saving embedding file to /local/hase/crosswalk-reproduction/results/experiment_75_linkpred_rice_node2vec_skip/embeddings/emb_2_node2vec_ed32_wl40_cs10_wpn80_nns5.pt
performing link prediction task..
Edge type 0 has accuracy: 62.80395136778115
Edge type 1 has accuracy: 55.3639846743295
Edge type 2 has accuracy: 55.319148936170215
Accuracy: 60.4296066252588
Disparity: 12.375264675926132
================================================================================
                        Performing experiment trial 4/5
================================================================================
loaded graph: data/dgl_graphs/rice/graph.bin
saved graph
Graph on device: cpu
graph shape, num_nodes=439, num_edges=19320
using prior edge weights without reweighting..
absolute difference between median of weights after reweighting: 0.0
generating node embeddings..
training on device: cpu
training node2vec model with : adam, lr=0.025, batch_size=32
saving embedding file to /local/hase/crosswalk-reproduction/results/experiment_75_linkpred_rice_node2vec_skip/embeddings/emb_3_node2vec_ed32_wl40_cs10_wpn80_nns5.pt
performing link prediction task..
Edge type 0 has accuracy: 59.665780478541585
Edge type 1 has accuracy: 55.53416746871992
Edge type 2 has accuracy: 53.645833333333336
Accuracy: 58.25569358178054
Disparity: 6.319532833432753
================================================================================
                        Performing experiment trial 5/5
================================================================================
loaded graph: data/dgl_graphs/rice/graph.bin
saved graph
Graph on device: cpu
graph shape, num_nodes=439, num_edges=19320
using prior edge weights without reweighting..
absolute difference between median of weights after reweighting: 0.0
generating node embeddings..
training on device: cpu
training node2vec model with : adam, lr=0.025, batch_size=32
saving embedding file to /local/hase/crosswalk-reproduction/results/experiment_75_linkpred_rice_node2vec_skip/embeddings/emb_4_node2vec_ed32_wl40_cs10_wpn80_nns5.pt
performing link prediction task..
Edge type 0 has accuracy: 62.36232434485378
Edge type 1 has accuracy: 54.66794995187681
Edge type 2 has accuracy: 53.125
Accuracy: 59.8343685300207
Disparity: 16.3235836561472
================================================================================
results for task link prediciton
--------------------------------------------------------------------------------
run 0:
    accuracy: 58.90269151138716
    disparity: 4.561814700230064
--------------------------------------------------------------------------------
run 1:
    accuracy: 58.35921325051759
    disparity: 9.39366065419982
--------------------------------------------------------------------------------
run 2:
    accuracy: 60.4296066252588
    disparity: 12.375264675926132
--------------------------------------------------------------------------------
run 3:
    accuracy: 58.25569358178054
    disparity: 6.319532833432753
--------------------------------------------------------------------------------
run 4:
    accuracy: 59.8343685300207
    disparity: 16.3235836561472
================================================================================
final average of all runs:
    accuracy: 59.15631469979296
    disparity: 9.794771303987194

final std/var of all runs:
    accuracy: std=0.8475663000010046, var=0.7183686328973931
    disparity: std=4.216784172085113, var=17.78126875394753
--------------------------------------------------------------------------------
accuracy values raw:
[58.90269151138716, 58.35921325051759, 60.4296066252588, 58.25569358178054, 59.8343685300207]
disparity values raw:
[4.561814700230064, 9.39366065419982, 12.375264675926132, 6.319532833432753, 16.3235836561472]
================================================================================
++++++++++++++++++++++++++++++++++++++++++++++++++++++++++++++++++++++++++++++++
             Experiment end time: 2026-01-16 14:12:15.883559
++++++++++++++++++++++++++++++++++++++++++++++++++++++++++++++++++++++++++++++++
