================================================================================
--------------------------------------------------------------------------------
|                         CROSSWALK REPRODUCTION SUITE                         |
--------------------------------------------------------------------------------
================================================================================
++++++++++++++++++++++++++++++++++++++++++++++++++++++++++++++++++++++++++++++++
             Experiment start time: 2026-01-16 13:59:57.770516
++++++++++++++++++++++++++++++++++++++++++++++++++++++++++++++++++++++++++++++++
Repeating experiment config: 
       'experiments/linkpred_rice_node2vec_skip.yml' 
5 times and averaging results
================================================================================
                        Performing experiment trial 1/5
================================================================================
loaded graph: data/dgl_graphs/rice/graph.bin
saved graph
Graph on device: cpu
graph shape, num_nodes=439, num_edges=19320
using prior edge weights without reweighting..
absolute difference between median of weights after reweighting: 0.0
generating node embeddings..
training on device: cpu
training node2vec model with : adam, lr=0.025, batch_size=32
saving embedding file to /local/hase/crosswalk-reproduction/results/experiment_72_linkpred_rice_node2vec_skip/embeddings/emb_0_node2vec_ed32_wl40_cs10_wpn80_nns5.pt
performing link prediction task..
Edge type 0 has accuracy: 56.6123531640773
Edge type 1 has accuracy: 52.90697674418605
Edge type 2 has accuracy: 55.95854922279793
Accuracy: 55.590062111801245
Disparity: 2.6077076221044346
================================================================================
                        Performing experiment trial 2/5
================================================================================
loaded graph: data/dgl_graphs/rice/graph.bin
saved graph
Graph on device: cpu
graph shape, num_nodes=439, num_edges=19320
using prior edge weights without reweighting..
absolute difference between median of weights after reweighting: 0.0
generating node embeddings..
training on device: cpu
training node2vec model with : adam, lr=0.025, batch_size=32
saving embedding file to /local/hase/crosswalk-reproduction/results/experiment_72_linkpred_rice_node2vec_skip/embeddings/emb_1_node2vec_ed32_wl40_cs10_wpn80_nns5.pt
performing link prediction task..
Edge type 0 has accuracy: 55.63995442461071
Edge type 1 has accuracy: 50.96153846153846
Edge type 2 has accuracy: 51.30890052356021
Accuracy: 54.166666666666664
Disparity: 4.529584913273993
================================================================================
                        Performing experiment trial 3/5
================================================================================
loaded graph: data/dgl_graphs/rice/graph.bin
saved graph
Graph on device: cpu
graph shape, num_nodes=439, num_edges=19320
using prior edge weights without reweighting..
absolute difference between median of weights after reweighting: 0.0
generating node embeddings..
training on device: cpu
training node2vec model with : adam, lr=0.025, batch_size=32
saving embedding file to /local/hase/crosswalk-reproduction/results/experiment_72_linkpred_rice_node2vec_skip/embeddings/emb_2_node2vec_ed32_wl40_cs10_wpn80_nns5.pt
performing link prediction task..
Edge type 0 has accuracy: 59.026985936906115
Edge type 1 has accuracy: 53.014354066985646
Edge type 2 has accuracy: 47.87234042553192
Accuracy: 56.85817805383023
Disparity: 20.77979586405557
================================================================================
                        Performing experiment trial 4/5
================================================================================
loaded graph: data/dgl_graphs/rice/graph.bin
saved graph
Graph on device: cpu
graph shape, num_nodes=439, num_edges=19320
using prior edge weights without reweighting..
absolute difference between median of weights after reweighting: 0.0
generating node embeddings..
training on device: cpu
training node2vec model with : adam, lr=0.025, batch_size=32
saving embedding file to /local/hase/crosswalk-reproduction/results/experiment_72_linkpred_rice_node2vec_skip/embeddings/emb_3_node2vec_ed32_wl40_cs10_wpn80_nns5.pt
performing link prediction task..
Edge type 0 has accuracy: 55.23917995444191
Edge type 1 has accuracy: 53.66088631984586
Edge type 2 has accuracy: 48.4375
Accuracy: 54.47722567287785
Disparity: 8.448625071779572
================================================================================
                        Performing experiment trial 5/5
================================================================================
loaded graph: data/dgl_graphs/rice/graph.bin
saved graph
Graph on device: cpu
graph shape, num_nodes=439, num_edges=19320
using prior edge weights without reweighting..
absolute difference between median of weights after reweighting: 0.0
generating node embeddings..
training on device: cpu
training node2vec model with : adam, lr=0.025, batch_size=32
saving embedding file to /local/hase/crosswalk-reproduction/results/experiment_72_linkpred_rice_node2vec_skip/embeddings/emb_4_node2vec_ed32_wl40_cs10_wpn80_nns5.pt
performing link prediction task..
Edge type 0 has accuracy: 57.12656784492588
Edge type 1 has accuracy: 50.86538461538461
Edge type 2 has accuracy: 59.58549222797927
Accuracy: 55.564182194616976
Disparity: 13.476555703410517
================================================================================
results for task link prediciton
--------------------------------------------------------------------------------
run 0:
    accuracy: 55.590062111801245
    disparity: 2.6077076221044346
--------------------------------------------------------------------------------
run 1:
    accuracy: 54.166666666666664
    disparity: 4.529584913273993
--------------------------------------------------------------------------------
run 2:
    accuracy: 56.85817805383023
    disparity: 20.77979586405557
--------------------------------------------------------------------------------
run 3:
    accuracy: 54.47722567287785
    disparity: 8.448625071779572
--------------------------------------------------------------------------------
run 4:
    accuracy: 55.564182194616976
    disparity: 13.476555703410517
================================================================================
final average of all runs:
    accuracy: 55.33126293995859
    disparity: 9.968453834924818

final std/var of all runs:
    accuracy: std=0.9527184567158217, var=0.907672457766977
    disparity: std=6.5614579876160795, var=43.052730923250856
--------------------------------------------------------------------------------
accuracy values raw:
[55.590062111801245, 54.166666666666664, 56.85817805383023, 54.47722567287785, 55.564182194616976]
disparity values raw:
[2.6077076221044346, 4.529584913273993, 20.77979586405557, 8.448625071779572, 13.476555703410517]
================================================================================
++++++++++++++++++++++++++++++++++++++++++++++++++++++++++++++++++++++++++++++++
             Experiment end time: 2026-01-16 14:02:54.489074
++++++++++++++++++++++++++++++++++++++++++++++++++++++++++++++++++++++++++++++++
