================================================================================
--------------------------------------------------------------------------------
|                         CROSSWALK REPRODUCTION SUITE                         |
--------------------------------------------------------------------------------
================================================================================
++++++++++++++++++++++++++++++++++++++++++++++++++++++++++++++++++++++++++++++++
             Experiment start time: 2026-01-16 14:55:13.428827
++++++++++++++++++++++++++++++++++++++++++++++++++++++++++++++++++++++++++++++++
Repeating experiment config: 
       'experiments/linkpred_rice_node2vec_skip.yml' 
5 times and averaging results
================================================================================
                        Performing experiment trial 1/5
================================================================================
loaded graph: data/dgl_graphs/deezer/graph.bin
saved graph
Graph on device: cpu
graph shape, num_nodes=28281, num_edges=185504
using prior edge weights without reweighting..
absolute difference between median of weights after reweighting: 0.0
generating node embeddings..
training on device: cpu
training node2vec model with : adam, lr=0.025, batch_size=32
saving embedding file to /local/hase/crosswalk-reproduction/results/experiment_76_linkpred_deezer_node2vec_skip/embeddings/emb_0_node2vec_ed32_wl40_cs10_wpn80_nns5.pt
performing link prediction task..
Edge type 0 has accuracy: 84.43364611260054
Edge type 1 has accuracy: 84.89328590484659
Edge type 2 has accuracy: 86.71591859492612
Accuracy: 85.09783839146138
Disparity: 0.9713362605714563
================================================================================
                        Performing experiment trial 2/5
================================================================================
loaded graph: data/dgl_graphs/deezer/graph.bin
saved graph
Graph on device: cpu
graph shape, num_nodes=28281, num_edges=185504
using prior edge weights without reweighting..
absolute difference between median of weights after reweighting: 0.0
generating node embeddings..
training on device: cpu
training node2vec model with : adam, lr=0.025, batch_size=32
saving embedding file to /local/hase/crosswalk-reproduction/results/experiment_76_linkpred_deezer_node2vec_skip/embeddings/emb_1_node2vec_ed32_wl40_cs10_wpn80_nns5.pt
performing link prediction task..
Edge type 0 has accuracy: 84.80449739889244
Edge type 1 has accuracy: 84.79372845546537
Edge type 2 has accuracy: 85.89886079466518
Accuracy: 85.01158967171581
Disparity: 0.2687849665883378
================================================================================
                        Performing experiment trial 3/5
================================================================================
loaded graph: data/dgl_graphs/deezer/graph.bin
saved graph
Graph on device: cpu
graph shape, num_nodes=28281, num_edges=185504
using prior edge weights without reweighting..
absolute difference between median of weights after reweighting: 0.0
generating node embeddings..
training on device: cpu
training node2vec model with : adam, lr=0.025, batch_size=32
saving embedding file to /local/hase/crosswalk-reproduction/results/experiment_76_linkpred_deezer_node2vec_skip/embeddings/emb_2_node2vec_ed32_wl40_cs10_wpn80_nns5.pt
performing link prediction task..
Edge type 0 has accuracy: 84.34884499497824
Edge type 1 has accuracy: 84.76047404439994
Edge type 2 has accuracy: 86.57568583762708
Accuracy: 84.97924640181122
Disparity: 0.9359169407875209
================================================================================
                        Performing experiment trial 4/5
================================================================================
loaded graph: data/dgl_graphs/deezer/graph.bin
saved graph
Graph on device: cpu
graph shape, num_nodes=28281, num_edges=185504
using prior edge weights without reweighting..
absolute difference between median of weights after reweighting: 0.0
generating node embeddings..
training on device: cpu
training node2vec model with : adam, lr=0.025, batch_size=32
saving embedding file to /local/hase/crosswalk-reproduction/results/experiment_76_linkpred_deezer_node2vec_skip/embeddings/emb_3_node2vec_ed32_wl40_cs10_wpn80_nns5.pt
performing link prediction task..
Edge type 0 has accuracy: 84.13243922883487
Edge type 1 has accuracy: 84.31557878349828
Edge type 2 has accuracy: 84.9986084052324
Accuracy: 84.3889817260525
Disparity: 0.1389242891988614
================================================================================
                        Performing experiment trial 5/5
================================================================================
loaded graph: data/dgl_graphs/deezer/graph.bin
saved graph
Graph on device: cpu
graph shape, num_nodes=28281, num_edges=185504
using prior edge weights without reweighting..
absolute difference between median of weights after reweighting: 0.0
generating node embeddings..
training on device: cpu
training node2vec model with : adam, lr=0.025, batch_size=32
saving embedding file to /local/hase/crosswalk-reproduction/results/experiment_76_linkpred_deezer_node2vec_skip/embeddings/emb_4_node2vec_ed32_wl40_cs10_wpn80_nns5.pt
performing link prediction task..
Edge type 0 has accuracy: 84.58319383997322
Edge type 1 has accuracy: 84.68763895064473
Edge type 2 has accuracy: 85.80005585032114
Accuracy: 84.86874022963721
Disparity: 0.3032370324507632
================================================================================
results for task link prediciton
--------------------------------------------------------------------------------
run 0:
    accuracy: 85.09783839146138
    disparity: 0.9713362605714563
--------------------------------------------------------------------------------
run 1:
    accuracy: 85.01158967171581
    disparity: 0.2687849665883378
--------------------------------------------------------------------------------
run 2:
    accuracy: 84.97924640181122
    disparity: 0.9359169407875209
--------------------------------------------------------------------------------
run 3:
    accuracy: 84.3889817260525
    disparity: 0.1389242891988614
--------------------------------------------------------------------------------
run 4:
    accuracy: 84.86874022963721
    disparity: 0.3032370324507632
================================================================================
final average of all runs:
    accuracy: 84.86927928413563
    disparity: 0.5236398979193879

final std/var of all runs:
    accuracy: std=0.2511056804634283, var=0.06305406276100135
    disparity: std=0.3555106051671946, var=0.12638779038634496
--------------------------------------------------------------------------------
accuracy values raw:
[85.09783839146138, 85.01158967171581, 84.97924640181122, 84.3889817260525, 84.86874022963721]
disparity values raw:
[0.9713362605714563, 0.2687849665883378, 0.9359169407875209, 0.1389242891988614, 0.3032370324507632]
================================================================================
++++++++++++++++++++++++++++++++++++++++++++++++++++++++++++++++++++++++++++++++
             Experiment end time: 2026-01-16 16:10:07.903342
++++++++++++++++++++++++++++++++++++++++++++++++++++++++++++++++++++++++++++++++
