================================================================================
--------------------------------------------------------------------------------
|                         CROSSWALK REPRODUCTION SUITE                         |
--------------------------------------------------------------------------------
================================================================================
++++++++++++++++++++++++++++++++++++++++++++++++++++++++++++++++++++++++++++++++
             Experiment start time: 2026-01-07 16:30:41.428952
++++++++++++++++++++++++++++++++++++++++++++++++++++++++++++++++++++++++++++++++
Repeating experiment config: 
       'experiments/infmax_rice_deepwalk_skip.yml' 
5 times and averaging results
================================================================================
                        Performing experiment trial 1/5
================================================================================
reading: data/immutable/rice/rice_subset.attr
number of attributed ids: 445, ids with edges: 439, number of links with attributes: 19320
Found unconnected nodes in graph! Removing 6 unconnected nodes
no edge weights given, initializing all as uniform normalized.
detected rice_raw dataset!
before rice parsing! num nodes:439, num edges:19320
after rice parsing! num nodes:439, num edges:19320
loaded graph: rice
saved graph
Graph on device: cpu
graph shape, num_nodes=439, num_edges=19320
using prior edge weights without reweighting..
absolute difference between median of weights after reweighting: 0.0
generating node embeddings..
training on device: cuda
training deepwalk model with : adam, lr=0.025, batch_size=32
saving embedding file to /local/hase/crosswalk-reproduction/results/experiment_6_infmax_rice_deepwalk_skip/embeddings/emb_0_deepwalk_ed32_wl40_cs10_wpn80_nns5.pt
performing influence maximization task..
Infected nodes fraction (%): 13.211845102505695
Infected nodes fraction per group (%):
    Group 0.0:13.15789520740509
    Group 1.0:13.40206116437912
Disparity: 0.014904253636260911
================================================================================
                        Performing experiment trial 2/5
================================================================================
reading: data/immutable/rice/rice_subset.attr
number of attributed ids: 445, ids with edges: 439, number of links with attributes: 19320
Found unconnected nodes in graph! Removing 6 unconnected nodes
no edge weights given, initializing all as uniform normalized.
detected rice_raw dataset!
before rice parsing! num nodes:439, num edges:19320
after rice parsing! num nodes:439, num edges:19320
loaded graph: rice
saved graph
Graph on device: cpu
graph shape, num_nodes=439, num_edges=19320
using prior edge weights without reweighting..
absolute difference between median of weights after reweighting: 0.0
generating node embeddings..
training on device: cuda
training deepwalk model with : adam, lr=0.025, batch_size=32
saving embedding file to /local/hase/crosswalk-reproduction/results/experiment_6_infmax_rice_deepwalk_skip/embeddings/emb_1_deepwalk_ed32_wl40_cs10_wpn80_nns5.pt
performing influence maximization task..
Infected nodes fraction (%): 15.717539863325742
Infected nodes fraction per group (%):
    Group 0.0:16.08187109231949
    Group 1.0:14.432989060878754
Disparity: 0.6797029884020311
================================================================================
                        Performing experiment trial 3/5
================================================================================
reading: data/immutable/rice/rice_subset.attr
number of attributed ids: 445, ids with edges: 439, number of links with attributes: 19320
Found unconnected nodes in graph! Removing 6 unconnected nodes
no edge weights given, initializing all as uniform normalized.
detected rice_raw dataset!
before rice parsing! num nodes:439, num edges:19320
after rice parsing! num nodes:439, num edges:19320
loaded graph: rice
saved graph
Graph on device: cpu
graph shape, num_nodes=439, num_edges=19320
using prior edge weights without reweighting..
absolute difference between median of weights after reweighting: 0.0
generating node embeddings..
training on device: cuda
training deepwalk model with : adam, lr=0.025, batch_size=32
saving embedding file to /local/hase/crosswalk-reproduction/results/experiment_6_infmax_rice_deepwalk_skip/embeddings/emb_2_deepwalk_ed32_wl40_cs10_wpn80_nns5.pt
performing influence maximization task..
Infected nodes fraction (%): 14.578587699316628
Infected nodes fraction per group (%):
    Group 0.0:15.204678475856781
    Group 1.0:12.371134012937546
Disparity: 2.007243555835064
================================================================================
                        Performing experiment trial 4/5
================================================================================
reading: data/immutable/rice/rice_subset.attr
number of attributed ids: 445, ids with edges: 439, number of links with attributes: 19320
Found unconnected nodes in graph! Removing 6 unconnected nodes
no edge weights given, initializing all as uniform normalized.
detected rice_raw dataset!
before rice parsing! num nodes:439, num edges:19320
after rice parsing! num nodes:439, num edges:19320
loaded graph: rice
saved graph
Graph on device: cpu
graph shape, num_nodes=439, num_edges=19320
using prior edge weights without reweighting..
absolute difference between median of weights after reweighting: 0.0
generating node embeddings..
training on device: cuda
training deepwalk model with : adam, lr=0.025, batch_size=32
saving embedding file to /local/hase/crosswalk-reproduction/results/experiment_6_infmax_rice_deepwalk_skip/embeddings/emb_3_deepwalk_ed32_wl40_cs10_wpn80_nns5.pt
performing influence maximization task..
Infected nodes fraction (%): 14.578587699316628
Infected nodes fraction per group (%):
    Group 0.0:14.327485859394073
    Group 1.0:15.463916957378387
Disparity: 0.32286891011645835
================================================================================
                        Performing experiment trial 5/5
================================================================================
reading: data/immutable/rice/rice_subset.attr
number of attributed ids: 445, ids with edges: 439, number of links with attributes: 19320
Found unconnected nodes in graph! Removing 6 unconnected nodes
no edge weights given, initializing all as uniform normalized.
detected rice_raw dataset!
before rice parsing! num nodes:439, num edges:19320
after rice parsing! num nodes:439, num edges:19320
loaded graph: rice
saved graph
Graph on device: cpu
graph shape, num_nodes=439, num_edges=19320
using prior edge weights without reweighting..
absolute difference between median of weights after reweighting: 0.0
generating node embeddings..
training on device: cuda
training deepwalk model with : adam, lr=0.025, batch_size=32
saving embedding file to /local/hase/crosswalk-reproduction/results/experiment_6_infmax_rice_deepwalk_skip/embeddings/emb_4_deepwalk_ed32_wl40_cs10_wpn80_nns5.pt
performing influence maximization task..
Infected nodes fraction (%): 14.80637813211845
Infected nodes fraction per group (%):
    Group 0.0:15.204678475856781
    Group 1.0:13.40206116437912
Disparity: 0.8123572929097378
================================================================================
results for task influence maximization
--------------------------------------------------------------------------------
run 0:
    infected_nodes_fraction: 13.211845102505695
    disparity: 0.014904253636260911
--------------------------------------------------------------------------------
run 1:
    infected_nodes_fraction: 15.717539863325742
    disparity: 0.6797029884020311
--------------------------------------------------------------------------------
run 2:
    infected_nodes_fraction: 14.578587699316628
    disparity: 2.007243555835064
--------------------------------------------------------------------------------
run 3:
    infected_nodes_fraction: 14.578587699316628
    disparity: 0.32286891011645835
--------------------------------------------------------------------------------
run 4:
    infected_nodes_fraction: 14.80637813211845
    disparity: 0.8123572929097378
================================================================================
final mean of all runs:
    infected_nodes_fraction: 14.578587699316628
    disparities: 0.7674154001799105

final std/var of all runs:
    infected_nodes_fraction: std=0.8021328866359461, var=0.6434171678229156
    disparities: std=0.6798208152090468, var=0.4621563407914929
--------------------------------------------------------------------------------
infected_nodes_fraction values raw:
[13.211845102505695, 15.717539863325742, 14.578587699316628, 14.578587699316628, 14.80637813211845]
disparity values raw:
[0.014904253636260911, 0.6797029884020311, 2.007243555835064, 0.32286891011645835, 0.8123572929097378]
================================================================================
++++++++++++++++++++++++++++++++++++++++++++++++++++++++++++++++++++++++++++++++
             Experiment end time: 2026-01-07 16:31:23.140192
++++++++++++++++++++++++++++++++++++++++++++++++++++++++++++++++++++++++++++++++
