================================================================================
--------------------------------------------------------------------------------
|                         CROSSWALK REPRODUCTION SUITE                         |
--------------------------------------------------------------------------------
================================================================================
++++++++++++++++++++++++++++++++++++++++++++++++++++++++++++++++++++++++++++++++
             Experiment start time: 2026-01-16 12:05:26.246145
++++++++++++++++++++++++++++++++++++++++++++++++++++++++++++++++++++++++++++++++
Repeating experiment config: 
       'experiments/linkpred_rice_node2vec_skip.yml' 
5 times and averaging results
================================================================================
                        Performing experiment trial 1/5
================================================================================
loaded graph: data/dgl_graphs/rice/graph.bin
saved graph
Graph on device: cpu
graph shape, num_nodes=439, num_edges=19320
using prior edge weights without reweighting..
absolute difference between median of weights after reweighting: 0.0
generating node embeddings..
training on device: cpu
training node2vec model with : adam, lr=0.025, batch_size=32
saving embedding file to /local/hase/crosswalk-reproduction/results/experiment_54_linkpred_rice_node2vec_skip/embeddings/emb_0_node2vec_ed32_wl40_cs10_wpn80_nns5.pt
performing link prediction task..
Edge type 0 has accuracy: 64.68359226979916
Edge type 1 has accuracy: 59.98062015503876
Edge type 2 has accuracy: 60.10362694300518
Accuracy: 63.19875776397515
Disparity: 4.789906641859432
================================================================================
                        Performing experiment trial 2/5
================================================================================
loaded graph: data/dgl_graphs/rice/graph.bin
saved graph
Graph on device: cpu
graph shape, num_nodes=439, num_edges=19320
using prior edge weights without reweighting..
absolute difference between median of weights after reweighting: 0.0
generating node embeddings..
training on device: cpu
training node2vec model with : adam, lr=0.025, batch_size=32
saving embedding file to /local/hase/crosswalk-reproduction/results/experiment_54_linkpred_rice_node2vec_skip/embeddings/emb_1_node2vec_ed32_wl40_cs10_wpn80_nns5.pt
performing link prediction task..
Edge type 0 has accuracy: 65.894417014812
Edge type 1 has accuracy: 59.13461538461539
Edge type 2 has accuracy: 58.63874345549738
Accuracy: 63.71635610766045
Disparity: 10.95395620544817
================================================================================
                        Performing experiment trial 3/5
================================================================================
loaded graph: data/dgl_graphs/rice/graph.bin
saved graph
Graph on device: cpu
graph shape, num_nodes=439, num_edges=19320
using prior edge weights without reweighting..
absolute difference between median of weights after reweighting: 0.0
generating node embeddings..
training on device: cpu
training node2vec model with : adam, lr=0.025, batch_size=32
saving embedding file to /local/hase/crosswalk-reproduction/results/experiment_54_linkpred_rice_node2vec_skip/embeddings/emb_2_node2vec_ed32_wl40_cs10_wpn80_nns5.pt
performing link prediction task..
Edge type 0 has accuracy: 65.69148936170212
Edge type 1 has accuracy: 60.91954022988506
Edge type 2 has accuracy: 56.38297872340425
Accuracy: 63.949275362318836
Disparity: 14.444473235781976
================================================================================
                        Performing experiment trial 4/5
================================================================================
loaded graph: data/dgl_graphs/rice/graph.bin
saved graph
Graph on device: cpu
graph shape, num_nodes=439, num_edges=19320
using prior edge weights without reweighting..
absolute difference between median of weights after reweighting: 0.0
generating node embeddings..
training on device: cpu
training node2vec model with : adam, lr=0.025, batch_size=32
saving embedding file to /local/hase/crosswalk-reproduction/results/experiment_54_linkpred_rice_node2vec_skip/embeddings/emb_3_node2vec_ed32_wl40_cs10_wpn80_nns5.pt
performing link prediction task..
Edge type 0 has accuracy: 65.0968477022408
Edge type 1 has accuracy: 61.02021174205967
Edge type 2 has accuracy: 56.770833333333336
Accuracy: 63.58695652173913
Disparity: 11.555410320404988
================================================================================
                        Performing experiment trial 5/5
================================================================================
loaded graph: data/dgl_graphs/rice/graph.bin
saved graph
Graph on device: cpu
graph shape, num_nodes=439, num_edges=19320
using prior edge weights without reweighting..
absolute difference between median of weights after reweighting: 0.0
generating node embeddings..
training on device: cpu
training node2vec model with : adam, lr=0.025, batch_size=32
saving embedding file to /local/hase/crosswalk-reproduction/results/experiment_54_linkpred_rice_node2vec_skip/embeddings/emb_4_node2vec_ed32_wl40_cs10_wpn80_nns5.pt
performing link prediction task..
Edge type 0 has accuracy: 65.59058108621343
Edge type 1 has accuracy: 59.28777670837344
Edge type 2 has accuracy: 58.854166666666664
Accuracy: 63.56107660455487
Disparity: 9.476959991718394
================================================================================
results for task link prediciton
--------------------------------------------------------------------------------
run 0:
    accuracy: 63.19875776397515
    disparity: 4.789906641859432
--------------------------------------------------------------------------------
run 1:
    accuracy: 63.71635610766045
    disparity: 10.95395620544817
--------------------------------------------------------------------------------
run 2:
    accuracy: 63.949275362318836
    disparity: 14.444473235781976
--------------------------------------------------------------------------------
run 3:
    accuracy: 63.58695652173913
    disparity: 11.555410320404988
--------------------------------------------------------------------------------
run 4:
    accuracy: 63.56107660455487
    disparity: 9.476959991718394
================================================================================
final average of all runs:
    accuracy: 63.602484472049696
    disparity: 10.244141279042593

final std/var of all runs:
    accuracy: std=0.2442055095669859, var=0.05963633090287124
    disparity: std=3.1686998873499728, var=10.040658976091729
--------------------------------------------------------------------------------
accuracy values raw:
[63.19875776397515, 63.71635610766045, 63.949275362318836, 63.58695652173913, 63.56107660455487]
disparity values raw:
[4.789906641859432, 10.95395620544817, 14.444473235781976, 11.555410320404988, 9.476959991718394]
================================================================================
++++++++++++++++++++++++++++++++++++++++++++++++++++++++++++++++++++++++++++++++
             Experiment end time: 2026-01-16 12:08:59.019295
++++++++++++++++++++++++++++++++++++++++++++++++++++++++++++++++++++++++++++++++
