================================================================================
--------------------------------------------------------------------------------
|                         CROSSWALK REPRODUCTION SUITE                         |
--------------------------------------------------------------------------------
================================================================================
++++++++++++++++++++++++++++++++++++++++++++++++++++++++++++++++++++++++++++++++
             Experiment start time: 2026-01-16 14:02:58.780759
++++++++++++++++++++++++++++++++++++++++++++++++++++++++++++++++++++++++++++++++
Repeating experiment config: 
       'experiments/linkpred_rice_node2vec_skip.yml' 
5 times and averaging results
================================================================================
                        Performing experiment trial 1/5
================================================================================
loaded graph: data/dgl_graphs/rice/graph.bin
saved graph
Graph on device: cpu
graph shape, num_nodes=439, num_edges=19320
using prior edge weights without reweighting..
absolute difference between median of weights after reweighting: 0.0
generating node embeddings..
training on device: cpu
training node2vec model with : adam, lr=0.025, batch_size=32
saving embedding file to /local/hase/crosswalk-reproduction/results/experiment_73_linkpred_rice_node2vec_skip/embeddings/emb_0_node2vec_ed32_wl40_cs10_wpn80_nns5.pt
performing link prediction task..
Edge type 0 has accuracy: 57.4838954149299
Edge type 1 has accuracy: 52.81007751937985
Edge type 2 has accuracy: 56.476683937823836
Accuracy: 56.18530020703933
Disparity: 4.033672367572515
================================================================================
                        Performing experiment trial 2/5
================================================================================
loaded graph: data/dgl_graphs/rice/graph.bin
saved graph
Graph on device: cpu
graph shape, num_nodes=439, num_edges=19320
using prior edge weights without reweighting..
absolute difference between median of weights after reweighting: 0.0
generating node embeddings..
training on device: cpu
training node2vec model with : adam, lr=0.025, batch_size=32
saving embedding file to /local/hase/crosswalk-reproduction/results/experiment_73_linkpred_rice_node2vec_skip/embeddings/emb_1_node2vec_ed32_wl40_cs10_wpn80_nns5.pt
performing link prediction task..
Edge type 0 has accuracy: 56.399544246107105
Edge type 1 has accuracy: 50.86538461538461
Edge type 2 has accuracy: 54.973821989528794
Accuracy: 54.83954451345756
Disparity: 5.504318269831777
================================================================================
                        Performing experiment trial 3/5
================================================================================
loaded graph: data/dgl_graphs/rice/graph.bin
saved graph
Graph on device: cpu
graph shape, num_nodes=439, num_edges=19320
using prior edge weights without reweighting..
absolute difference between median of weights after reweighting: 0.0
generating node embeddings..
training on device: cpu
training node2vec model with : adam, lr=0.025, batch_size=32
saving embedding file to /local/hase/crosswalk-reproduction/results/experiment_73_linkpred_rice_node2vec_skip/embeddings/emb_2_node2vec_ed32_wl40_cs10_wpn80_nns5.pt
performing link prediction task..
Edge type 0 has accuracy: 59.764437689969604
Edge type 1 has accuracy: 54.02298850574713
Edge type 2 has accuracy: 51.59574468085106
Accuracy: 57.815734989648035
Disparity: 11.731477421969684
================================================================================
                        Performing experiment trial 4/5
================================================================================
loaded graph: data/dgl_graphs/rice/graph.bin
saved graph
Graph on device: cpu
graph shape, num_nodes=439, num_edges=19320
using prior edge weights without reweighting..
absolute difference between median of weights after reweighting: 0.0
generating node embeddings..
training on device: cpu
training node2vec model with : adam, lr=0.025, batch_size=32
saving embedding file to /local/hase/crosswalk-reproduction/results/experiment_73_linkpred_rice_node2vec_skip/embeddings/emb_3_node2vec_ed32_wl40_cs10_wpn80_nns5.pt
performing link prediction task..
Edge type 0 has accuracy: 56.361564755032276
Edge type 1 has accuracy: 55.24542829643888
Edge type 2 has accuracy: 54.6875
Accuracy: 55.97826086956522
Disparity: 0.48439304246776366
================================================================================
                        Performing experiment trial 5/5
================================================================================
loaded graph: data/dgl_graphs/rice/graph.bin
saved graph
Graph on device: cpu
graph shape, num_nodes=439, num_edges=19320
using prior edge weights without reweighting..
absolute difference between median of weights after reweighting: 0.0
generating node embeddings..
training on device: cpu
training node2vec model with : adam, lr=0.025, batch_size=32
saving embedding file to /local/hase/crosswalk-reproduction/results/experiment_73_linkpred_rice_node2vec_skip/embeddings/emb_4_node2vec_ed32_wl40_cs10_wpn80_nns5.pt
performing link prediction task..
Edge type 0 has accuracy: 59.62780098746677
Edge type 1 has accuracy: 52.45428296438883
Edge type 2 has accuracy: 54.6875
Accuracy: 57.453416149068325
Disparity: 8.983688111370345
================================================================================
results for task link prediciton
--------------------------------------------------------------------------------
run 0:
    accuracy: 56.18530020703933
    disparity: 4.033672367572515
--------------------------------------------------------------------------------
run 1:
    accuracy: 54.83954451345756
    disparity: 5.504318269831777
--------------------------------------------------------------------------------
run 2:
    accuracy: 57.815734989648035
    disparity: 11.731477421969684
--------------------------------------------------------------------------------
run 3:
    accuracy: 55.97826086956522
    disparity: 0.48439304246776366
--------------------------------------------------------------------------------
run 4:
    accuracy: 57.453416149068325
    disparity: 8.983688111370345
================================================================================
final average of all runs:
    accuracy: 56.45445134575569
    disparity: 6.1475098426424175

final std/var of all runs:
    accuracy: std=1.0731400299566007, var=1.1516295238952539
    disparity: std=3.9032677915241094, var=15.235499452349497
--------------------------------------------------------------------------------
accuracy values raw:
[56.18530020703933, 54.83954451345756, 57.815734989648035, 55.97826086956522, 57.453416149068325]
disparity values raw:
[4.033672367572515, 5.504318269831777, 11.731477421969684, 0.48439304246776366, 8.983688111370345]
================================================================================
++++++++++++++++++++++++++++++++++++++++++++++++++++++++++++++++++++++++++++++++
             Experiment end time: 2026-01-16 14:05:58.495855
++++++++++++++++++++++++++++++++++++++++++++++++++++++++++++++++++++++++++++++++
