================================================================================
--------------------------------------------------------------------------------
|                         CROSSWALK REPRODUCTION SUITE                         |
--------------------------------------------------------------------------------
================================================================================
++++++++++++++++++++++++++++++++++++++++++++++++++++++++++++++++++++++++++++++++
             Experiment start time: 2026-01-08 18:04:36.564332
++++++++++++++++++++++++++++++++++++++++++++++++++++++++++++++++++++++++++++++++
Repeating experiment config: 
       'experiments/infmax_pokec_region_deepwalk_crosswalk.yml' 
5 times and averaging results
================================================================================
                        Performing experiment trial 1/5
================================================================================
loaded graph: data/dgl_graphs/pokec_region/graph.bin
saved graph
Graph on device: cpu
graph shape, num_nodes=67796, num_edges=1235916
performing edge reweighting with crosswalk
reweighted edges
absolute difference between median of weights after reweighting: 0.022958066314458847
generating node embeddings..
training on device: cuda
training deepwalk model with : adam, lr=0.025, batch_size=32
saving embedding file to /local/hase/crosswalk-reproduction/results/experiment_30_infmax_pokec_region_deepwalk_crosswalk/embeddings/emb_0_deepwalk_ed32_wl40_cs10_wpn80_nns5.pt
performing influence maximization task..
Infected nodes fraction (%): 0.07965071685645171
Infected nodes fraction per group (%):
    Group 0:0.09781174594536424
    Group 1:0.0461525545688346
Disparity: 0.0006671680134192284
================================================================================
                        Performing experiment trial 2/5
================================================================================
loaded graph: data/dgl_graphs/pokec_region/graph.bin
saved graph
Graph on device: cpu
graph shape, num_nodes=67796, num_edges=1235916
performing edge reweighting with crosswalk
reweighted edges
absolute difference between median of weights after reweighting: 0.02296864241361618
generating node embeddings..
training on device: cuda
training deepwalk model with : adam, lr=0.025, batch_size=32
saving embedding file to /local/hase/crosswalk-reproduction/results/experiment_30_infmax_pokec_region_deepwalk_crosswalk/embeddings/emb_1_deepwalk_ed32_wl40_cs10_wpn80_nns5.pt
performing influence maximization task..
Infected nodes fraction (%): 0.09292583633252699
Infected nodes fraction per group (%):
    Group 0:0.11145989410579205
    Group 1:0.058739614905789495
Disparity: 0.0006948569597315554
================================================================================
                        Performing experiment trial 3/5
================================================================================
loaded graph: data/dgl_graphs/pokec_region/graph.bin
saved graph
Graph on device: cpu
graph shape, num_nodes=67796, num_edges=1235916
performing edge reweighting with crosswalk
reweighted edges
absolute difference between median of weights after reweighting: 0.02296048030257225
generating node embeddings..
training on device: cuda
training deepwalk model with : adam, lr=0.025, batch_size=32
saving embedding file to /local/hase/crosswalk-reproduction/results/experiment_30_infmax_pokec_region_deepwalk_crosswalk/embeddings/emb_2_deepwalk_ed32_wl40_cs10_wpn80_nns5.pt
performing influence maximization task..
Infected nodes fraction (%): 0.12095108855979704
Infected nodes fraction per group (%):
    Group 0:0.10236112866550684
    Group 1:0.1552404137328267
Disparity: 0.0006990546973077195
================================================================================
                        Performing experiment trial 4/5
================================================================================
loaded graph: data/dgl_graphs/pokec_region/graph.bin
saved graph
Graph on device: cpu
graph shape, num_nodes=67796, num_edges=1235916
performing edge reweighting with crosswalk
reweighted edges
absolute difference between median of weights after reweighting: 0.02295524813234806
generating node embeddings..
training on device: cuda
training deepwalk model with : adam, lr=0.025, batch_size=32
saving embedding file to /local/hase/crosswalk-reproduction/results/experiment_30_infmax_pokec_region_deepwalk_crosswalk/embeddings/emb_3_deepwalk_ed32_wl40_cs10_wpn80_nns5.pt
performing influence maximization task..
Infected nodes fraction (%): 0.08702578323204908
Infected nodes fraction per group (%):
    Group 0:0.10691051138564944
    Group 1:0.05034824134781957
Disparity: 0.0007998225979580968
================================================================================
                        Performing experiment trial 5/5
================================================================================
loaded graph: data/dgl_graphs/pokec_region/graph.bin
saved graph
Graph on device: cpu
graph shape, num_nodes=67796, num_edges=1235916
performing edge reweighting with crosswalk
reweighted edges
absolute difference between median of weights after reweighting: 0.022975269705057144
generating node embeddings..
training on device: cuda
training deepwalk model with : adam, lr=0.025, batch_size=32
saving embedding file to /local/hase/crosswalk-reproduction/results/experiment_30_infmax_pokec_region_deepwalk_crosswalk/embeddings/emb_4_deepwalk_ed32_wl40_cs10_wpn80_nns5.pt
performing influence maximization task..
Infected nodes fraction (%): 0.06342557083013747
Infected nodes fraction per group (%):
    Group 0:0.06369136972352862
    Group 1:0.0629353045951575
Disparity: 1.4290861958470935e-07
================================================================================
results for task influence maximization
--------------------------------------------------------------------------------
run 0:
    infected_nodes_fraction: 0.07965071685645171
    disparity: 0.0006671680134192284
--------------------------------------------------------------------------------
run 1:
    infected_nodes_fraction: 0.09292583633252699
    disparity: 0.0006948569597315554
--------------------------------------------------------------------------------
run 2:
    infected_nodes_fraction: 0.12095108855979704
    disparity: 0.0006990546973077195
--------------------------------------------------------------------------------
run 3:
    infected_nodes_fraction: 0.08702578323204908
    disparity: 0.0007998225979580968
--------------------------------------------------------------------------------
run 4:
    infected_nodes_fraction: 0.06342557083013747
    disparity: 1.4290861958470935e-07
================================================================================
final mean of all runs:
    infected_nodes_fraction: 0.08879579916219245
    disparities: 0.000572209035407237

final std/var of all runs:
    infected_nodes_fraction: std=0.01887555994223422, var=0.00035628676313287713
    disparities: std=0.0002895572931438742, var=8.384342601280751e-08
--------------------------------------------------------------------------------
infected_nodes_fraction values raw:
[0.07965071685645171, 0.09292583633252699, 0.12095108855979704, 0.08702578323204908, 0.06342557083013747]
disparity values raw:
[0.0006671680134192284, 0.0006948569597315554, 0.0006990546973077195, 0.0007998225979580968, 1.4290861958470935e-07]
================================================================================
++++++++++++++++++++++++++++++++++++++++++++++++++++++++++++++++++++++++++++++++
             Experiment end time: 2026-01-08 19:52:48.874740
++++++++++++++++++++++++++++++++++++++++++++++++++++++++++++++++++++++++++++++++
