================================================================================
--------------------------------------------------------------------------------
|                         CROSSWALK REPRODUCTION SUITE                         |
--------------------------------------------------------------------------------
================================================================================
++++++++++++++++++++++++++++++++++++++++++++++++++++++++++++++++++++++++++++++++
             Experiment start time: 2026-01-16 12:01:57.746760
++++++++++++++++++++++++++++++++++++++++++++++++++++++++++++++++++++++++++++++++
Repeating experiment config: 
       'experiments/linkpred_rice_node2vec_skip.yml' 
5 times and averaging results
================================================================================
                        Performing experiment trial 1/5
================================================================================
loaded graph: data/dgl_graphs/rice/graph.bin
saved graph
Graph on device: cpu
graph shape, num_nodes=439, num_edges=19320
using prior edge weights without reweighting..
absolute difference between median of weights after reweighting: 0.0
generating node embeddings..
training on device: cpu
training node2vec model with : adam, lr=0.025, batch_size=32
saving embedding file to /local/hase/crosswalk-reproduction/results/experiment_53_linkpred_rice_node2vec_skip/embeddings/emb_0_node2vec_ed32_wl40_cs10_wpn80_nns5.pt
performing link prediction task..
Edge type 0 has accuracy: 63.81205001894658
Edge type 1 has accuracy: 59.98062015503876
Edge type 2 has accuracy: 61.6580310880829
Accuracy: 62.68115942028986
Disparity: 2.4592621994288706
================================================================================
                        Performing experiment trial 2/5
================================================================================
loaded graph: data/dgl_graphs/rice/graph.bin
saved graph
Graph on device: cpu
graph shape, num_nodes=439, num_edges=19320
using prior edge weights without reweighting..
absolute difference between median of weights after reweighting: 0.0
generating node embeddings..
training on device: cpu
training node2vec model with : adam, lr=0.025, batch_size=32
saving embedding file to /local/hase/crosswalk-reproduction/results/experiment_53_linkpred_rice_node2vec_skip/embeddings/emb_1_node2vec_ed32_wl40_cs10_wpn80_nns5.pt
performing link prediction task..
Edge type 0 has accuracy: 62.604403948367505
Edge type 1 has accuracy: 59.23076923076923
Edge type 2 has accuracy: 58.42105263157895
Accuracy: 61.49068322981367
Disparity: 3.2819422687183515
================================================================================
                        Performing experiment trial 3/5
================================================================================
loaded graph: data/dgl_graphs/rice/graph.bin
saved graph
Graph on device: cpu
graph shape, num_nodes=439, num_edges=19320
using prior edge weights without reweighting..
absolute difference between median of weights after reweighting: 0.0
generating node embeddings..
training on device: cpu
training node2vec model with : adam, lr=0.025, batch_size=32
saving embedding file to /local/hase/crosswalk-reproduction/results/experiment_53_linkpred_rice_node2vec_skip/embeddings/emb_2_node2vec_ed32_wl40_cs10_wpn80_nns5.pt
performing link prediction task..
Edge type 0 has accuracy: 64.27213987077157
Edge type 1 has accuracy: 60.86124401913876
Edge type 2 has accuracy: 59.57446808510638
Accuracy: 63.121118012422365
Disparity: 3.928680335658393
================================================================================
                        Performing experiment trial 4/5
================================================================================
loaded graph: data/dgl_graphs/rice/graph.bin
saved graph
Graph on device: cpu
graph shape, num_nodes=439, num_edges=19320
using prior edge weights without reweighting..
absolute difference between median of weights after reweighting: 0.0
generating node embeddings..
training on device: cpu
training node2vec model with : adam, lr=0.025, batch_size=32
saving embedding file to /local/hase/crosswalk-reproduction/results/experiment_53_linkpred_rice_node2vec_skip/embeddings/emb_3_node2vec_ed32_wl40_cs10_wpn80_nns5.pt
performing link prediction task..
Edge type 0 has accuracy: 61.06261859582543
Edge type 1 has accuracy: 60.9450337512054
Edge type 2 has accuracy: 58.333333333333336
Accuracy: 60.89544513457557
Disparity: 1.5870892569393285
================================================================================
                        Performing experiment trial 5/5
================================================================================
loaded graph: data/dgl_graphs/rice/graph.bin
saved graph
Graph on device: cpu
graph shape, num_nodes=439, num_edges=19320
using prior edge weights without reweighting..
absolute difference between median of weights after reweighting: 0.0
generating node embeddings..
training on device: cpu
training node2vec model with : adam, lr=0.025, batch_size=32
saving embedding file to /local/hase/crosswalk-reproduction/results/experiment_53_linkpred_rice_node2vec_skip/embeddings/emb_4_node2vec_ed32_wl40_cs10_wpn80_nns5.pt
performing link prediction task..
Edge type 0 has accuracy: 64.32370820668693
Edge type 1 has accuracy: 57.49999999999999
Edge type 2 has accuracy: 59.375
Accuracy: 62.24120082815735
Disparity: 8.285370178326364
================================================================================
results for task link prediciton
--------------------------------------------------------------------------------
run 0:
    accuracy: 62.68115942028986
    disparity: 2.4592621994288706
--------------------------------------------------------------------------------
run 1:
    accuracy: 61.49068322981367
    disparity: 3.2819422687183515
--------------------------------------------------------------------------------
run 2:
    accuracy: 63.121118012422365
    disparity: 3.928680335658393
--------------------------------------------------------------------------------
run 3:
    accuracy: 60.89544513457557
    disparity: 1.5870892569393285
--------------------------------------------------------------------------------
run 4:
    accuracy: 62.24120082815735
    disparity: 8.285370178326364
================================================================================
final average of all runs:
    accuracy: 62.085921325051764
    disparity: 3.9084688478142615

final std/var of all runs:
    accuracy: std=0.8026947421982845, var=0.6443188491527705
    disparity: std=2.325476829824292, var=5.40784248604964
--------------------------------------------------------------------------------
accuracy values raw:
[62.68115942028986, 61.49068322981367, 63.121118012422365, 60.89544513457557, 62.24120082815735]
disparity values raw:
[2.4592621994288706, 3.2819422687183515, 3.928680335658393, 1.5870892569393285, 8.285370178326364]
================================================================================
++++++++++++++++++++++++++++++++++++++++++++++++++++++++++++++++++++++++++++++++
             Experiment end time: 2026-01-16 12:05:22.574278
++++++++++++++++++++++++++++++++++++++++++++++++++++++++++++++++++++++++++++++++
