================================================================================
--------------------------------------------------------------------------------
|                         CROSSWALK REPRODUCTION SUITE                         |
--------------------------------------------------------------------------------
================================================================================
++++++++++++++++++++++++++++++++++++++++++++++++++++++++++++++++++++++++++++++++
             Experiment start time: 2026-01-16 18:38:40.144375
++++++++++++++++++++++++++++++++++++++++++++++++++++++++++++++++++++++++++++++++
Repeating experiment config: 
       'experiments/linkpred_rice_node2vec_skip.yml' 
5 times and averaging results
================================================================================
                        Performing experiment trial 1/5
================================================================================
loaded graph: data/dgl_graphs/deezer/graph.bin
saved graph
Graph on device: cpu
graph shape, num_nodes=28281, num_edges=185504
using prior edge weights without reweighting..
absolute difference between median of weights after reweighting: 0.0
generating node embeddings..
training on device: cpu
training node2vec model with : adam, lr=0.025, batch_size=32
saving embedding file to /local/hase/crosswalk-reproduction/results/experiment_79_linkpred_deezer_node2vec_skip/embeddings/emb_0_node2vec_ed32_wl40_cs10_wpn80_nns5.pt
performing link prediction task..
Edge type 0 has accuracy: 71.92291579388353
Edge type 1 has accuracy: 72.43372422608793
Edge type 2 has accuracy: 74.10091998884863
Accuracy: 72.59177402835427
Disparity: 0.864907693229323
================================================================================
                        Performing experiment trial 2/5
================================================================================
loaded graph: data/dgl_graphs/deezer/graph.bin
saved graph
Graph on device: cpu
graph shape, num_nodes=28281, num_edges=185504
using prior edge weights without reweighting..
absolute difference between median of weights after reweighting: 0.0
generating node embeddings..
training on device: cpu
training node2vec model with : adam, lr=0.025, batch_size=32
saving embedding file to /local/hase/crosswalk-reproduction/results/experiment_79_linkpred_deezer_node2vec_skip/embeddings/emb_1_node2vec_ed32_wl40_cs10_wpn80_nns5.pt
performing link prediction task..
Edge type 0 has accuracy: 71.97516361805673
Edge type 1 has accuracy: 72.65651061937062
Edge type 2 has accuracy: 73.56210058349542
Accuracy: 72.61333620829066
Disparity: 0.42252176128875235
================================================================================
                        Performing experiment trial 3/5
================================================================================
loaded graph: data/dgl_graphs/deezer/graph.bin
saved graph
Graph on device: cpu
graph shape, num_nodes=28281, num_edges=185504
using prior edge weights without reweighting..
absolute difference between median of weights after reweighting: 0.0
generating node embeddings..
training on device: cpu
training node2vec model with : adam, lr=0.025, batch_size=32
saving embedding file to /local/hase/crosswalk-reproduction/results/experiment_79_linkpred_deezer_node2vec_skip/embeddings/emb_2_node2vec_ed32_wl40_cs10_wpn80_nns5.pt
performing link prediction task..
Edge type 0 has accuracy: 73.26525487570102
Edge type 1 has accuracy: 72.9579345648787
Edge type 2 has accuracy: 73.67395238758179
Accuracy: 73.19551506657324
Disparity: 0.08601788356554914
================================================================================
                        Performing experiment trial 4/5
================================================================================
loaded graph: data/dgl_graphs/deezer/graph.bin
saved graph
Graph on device: cpu
graph shape, num_nodes=28281, num_edges=185504
using prior edge weights without reweighting..
absolute difference between median of weights after reweighting: 0.0
generating node embeddings..
training on device: cpu
training node2vec model with : adam, lr=0.025, batch_size=32
saving embedding file to /local/hase/crosswalk-reproduction/results/experiment_79_linkpred_deezer_node2vec_skip/embeddings/emb_3_node2vec_ed32_wl40_cs10_wpn80_nns5.pt
performing link prediction task..
Edge type 0 has accuracy: 71.60100586756077
Edge type 1 has accuracy: 72.57463723800522
Edge type 2 has accuracy: 74.69728601252609
Accuracy: 72.67263220311574
Disparity: 1.6711718446216608
================================================================================
                        Performing experiment trial 5/5
================================================================================
loaded graph: data/dgl_graphs/deezer/graph.bin
saved graph
Graph on device: cpu
graph shape, num_nodes=28281, num_edges=185504
using prior edge weights without reweighting..
absolute difference between median of weights after reweighting: 0.0
generating node embeddings..
training on device: cpu
training node2vec model with : adam, lr=0.025, batch_size=32
saving embedding file to /local/hase/crosswalk-reproduction/results/experiment_79_linkpred_deezer_node2vec_skip/embeddings/emb_4_node2vec_ed32_wl40_cs10_wpn80_nns5.pt
performing link prediction task..
Edge type 0 has accuracy: 72.3575194576952
Edge type 1 has accuracy: 72.01222901612006
Edge type 2 has accuracy: 73.23747033365908
Accuracy: 72.35998059403805
Disparity: 0.26608392437305406
================================================================================
results for task link prediciton
--------------------------------------------------------------------------------
run 0:
    accuracy: 72.59177402835427
    disparity: 0.864907693229323
--------------------------------------------------------------------------------
run 1:
    accuracy: 72.61333620829066
    disparity: 0.42252176128875235
--------------------------------------------------------------------------------
run 2:
    accuracy: 73.19551506657324
    disparity: 0.08601788356554914
--------------------------------------------------------------------------------
run 3:
    accuracy: 72.67263220311574
    disparity: 1.6711718446216608
--------------------------------------------------------------------------------
run 4:
    accuracy: 72.35998059403805
    disparity: 0.26608392437305406
================================================================================
final average of all runs:
    accuracy: 72.6866476200744
    disparity: 0.662140621415668

final std/var of all runs:
    accuracy: std=0.27576418093066707, var=0.0760458834843617
    disparity: std=0.5666487464532521, var=0.32109080185704203
--------------------------------------------------------------------------------
accuracy values raw:
[72.59177402835427, 72.61333620829066, 73.19551506657324, 72.67263220311574, 72.35998059403805]
disparity values raw:
[0.864907693229323, 0.42252176128875235, 0.08601788356554914, 1.6711718446216608, 0.26608392437305406]
================================================================================
++++++++++++++++++++++++++++++++++++++++++++++++++++++++++++++++++++++++++++++++
             Experiment end time: 2026-01-16 19:53:21.924059
++++++++++++++++++++++++++++++++++++++++++++++++++++++++++++++++++++++++++++++++
